{"axis": "?", "experiment-id": 1, "outcome": "discarded", "score": 0.39999999999999997, "strategy": "template-default", "target": "lisp/modules/gptel-tools-agent-error.el", "timestamp": "2026-05-06 17:34:45"}
{"axis": "?", "experiment-id": 2, "outcome": "discarded", "score": 0.4125, "strategy": "template-default", "target": "lisp/modules/gptel-tools-agent-error.el", "timestamp": "2026-05-06 17:54:24"}
{"axis": "?", "experiment-id": 1, "outcome": "discarded", "score": 0.39999999999999997, "strategy": "template-default", "target": "lisp/modules/gptel-ext-context-cache.el", "timestamp": "2026-05-06 19:07:58"}
{"axis": "?", "experiment-id": 1, "outcome": "kept", "score": 0.7, "strategy": "template-default", "target": "one", "timestamp": "2026-05-06 19:10:36"}
{"axis": "?", "experiment-id": 1, "outcome": "discarded", "score": 0.7, "strategy": "template-default", "target": "one", "timestamp": "2026-05-06 19:10:36"}
{"axis": "?", "experiment-id": 1, "outcome": "discarded", "score": 0, "strategy": "template-default", "target": "one", "timestamp": "2026-05-06 19:10:36"}
{"axis": "?", "experiment-id": 2, "outcome": "discarded", "score": 0, "strategy": "template-default", "target": "two", "timestamp": "2026-05-06 19:10:36"}
{"axis": "?", "experiment-id": 3, "outcome": "discarded", "score": 0, "strategy": "template-default", "target": "three", "timestamp": "2026-05-06 19:10:36"}
{"axis": "?", "experiment-id": 4, "outcome": "discarded", "score": 0, "strategy": "template-default", "target": "four", "timestamp": "2026-05-06 19:10:36"}
{"axis": "?", "experiment-id": 1, "outcome": "discarded", "score": 0.7, "strategy": "template-default", "target": "one", "timestamp": "2026-05-06 19:10:36"}
{"axis": "?", "experiment-id": 1, "outcome": "kept", "score": 0.7, "strategy": "template-default", "target": "one", "timestamp": "2026-05-06 19:10:36"}
{"axis": "?", "experiment-id": 1, "outcome": "kept", "score": 0, "strategy": "template-default", "target": "one", "timestamp": "2026-05-06 19:10:36"}
{"axis": "?", "experiment-id": 2, "outcome": "kept", "score": 0, "strategy": "template-default", "target": "one", "timestamp": "2026-05-06 19:10:36"}
{"axis": "?", "experiment-id": 3, "outcome": "discarded", "score": 0, "strategy": "template-default", "target": "two", "timestamp": "2026-05-06 19:10:36"}
{"axis": "?", "experiment-id": 4, "outcome": "kept", "score": 0, "strategy": "template-default", "target": "two", "timestamp": "2026-05-06 19:10:36"}
{"axis": "?", "experiment-id": 1, "outcome": "kept", "score": 0.39999999999999997, "strategy": "template-default", "target": "lisp/modules/gptel-ext-context-cache.el", "timestamp": "2026-05-06 19:11:18"}
{"axis": "?", "experiment-id": 2, "outcome": "discarded", "score": 0.39999999999999997, "strategy": "template-default", "target": "lisp/modules/gptel-ext-context-cache.el", "timestamp": "2026-05-06 19:16:28"}
{"axis": "?", "experiment-id": 3, "outcome": "discarded", "score": 0.39999999999999997, "strategy": "template-default", "target": "lisp/modules/gptel-ext-context-cache.el", "timestamp": "2026-05-06 19:24:27"}
{"axis": "?", "experiment-id": 4, "outcome": "discarded", "score": 0.39999999999999997, "strategy": "template-default", "target": "lisp/modules/gptel-ext-context-cache.el", "timestamp": "2026-05-06 19:34:48"}
{"axis": "?", "experiment-id": 1, "outcome": "discarded", "score": 0.39999999999999997, "strategy": "template-default", "target": "lisp/modules/gptel-sandbox.el", "timestamp": "2026-05-06 23:06:54"}
{"axis": "?", "experiment-id": 1, "outcome": "kept", "score": 0.7, "strategy": "template-default", "target": "one", "timestamp": "2026-05-06 23:09:42"}
{"axis": "?", "experiment-id": 1, "outcome": "discarded", "score": 0.7, "strategy": "template-default", "target": "one", "timestamp": "2026-05-06 23:09:42"}
{"axis": "?", "experiment-id": 1, "outcome": "discarded", "score": 0, "strategy": "template-default", "target": "one", "timestamp": "2026-05-06 23:09:42"}
{"axis": "?", "experiment-id": 2, "outcome": "discarded", "score": 0, "strategy": "template-default", "target": "two", "timestamp": "2026-05-06 23:09:42"}
{"axis": "?", "experiment-id": 3, "outcome": "discarded", "score": 0, "strategy": "template-default", "target": "three", "timestamp": "2026-05-06 23:09:42"}
{"axis": "?", "experiment-id": 4, "outcome": "discarded", "score": 0, "strategy": "template-default", "target": "four", "timestamp": "2026-05-06 23:09:42"}
{"axis": "?", "experiment-id": 1, "outcome": "discarded", "score": 0.7, "strategy": "template-default", "target": "one", "timestamp": "2026-05-06 23:09:42"}
{"axis": "?", "experiment-id": 1, "outcome": "kept", "score": 0.7, "strategy": "template-default", "target": "one", "timestamp": "2026-05-06 23:09:42"}
{"axis": "?", "experiment-id": 1, "outcome": "kept", "score": 0, "strategy": "template-default", "target": "one", "timestamp": "2026-05-06 23:09:42"}
{"axis": "?", "experiment-id": 2, "outcome": "kept", "score": 0, "strategy": "template-default", "target": "one", "timestamp": "2026-05-06 23:09:42"}
{"axis": "?", "experiment-id": 3, "outcome": "discarded", "score": 0, "strategy": "template-default", "target": "two", "timestamp": "2026-05-06 23:09:42"}
{"axis": "?", "experiment-id": 4, "outcome": "kept", "score": 0, "strategy": "template-default", "target": "two", "timestamp": "2026-05-06 23:09:42"}
{"axis": "?", "experiment-id": 1, "outcome": "kept", "score": 0.39999999999999997, "strategy": "template-default", "target": "lisp/modules/gptel-sandbox.el", "timestamp": "2026-05-06 23:10:25"}
{"axis": "?", "experiment-id": 2, "outcome": "discarded", "score": 0.39999999999999997, "strategy": "template-default", "target": "lisp/modules/gptel-sandbox.el", "timestamp": "2026-05-06 23:16:43"}
{"axis": "?", "experiment-id": 3, "outcome": "discarded", "score": 0.3916666666666666, "strategy": "template-default", "target": "lisp/modules/gptel-sandbox.el", "timestamp": "2026-05-06 23:24:10"}
{"axis": "?", "experiment-id": 4, "outcome": "discarded", "score": 0.39999999999999997, "strategy": "template-default", "target": "lisp/modules/gptel-sandbox.el", "timestamp": "2026-05-06 23:29:48"}
{"axis": "?", "experiment-id": 1, "outcome": "discarded", "score": 0.39999999999999997, "strategy": "template-default", "target": "lisp/modules/gptel-tools-agent-error.el", "timestamp": "2026-05-07 03:11:26"}
{"axis": "?", "experiment-id": 1, "outcome": "kept", "score": 0.7, "strategy": "template-default", "target": "one", "timestamp": "2026-05-07 03:13:52"}
{"axis": "?", "experiment-id": 1, "outcome": "discarded", "score": 0.7, "strategy": "template-default", "target": "one", "timestamp": "2026-05-07 03:13:52"}
{"axis": "?", "experiment-id": 1, "outcome": "discarded", "score": 0, "strategy": "template-default", "target": "one", "timestamp": "2026-05-07 03:13:52"}
{"axis": "?", "experiment-id": 2, "outcome": "discarded", "score": 0, "strategy": "template-default", "target": "two", "timestamp": "2026-05-07 03:13:52"}
{"axis": "?", "experiment-id": 3, "outcome": "discarded", "score": 0, "strategy": "template-default", "target": "three", "timestamp": "2026-05-07 03:13:52"}
{"axis": "?", "experiment-id": 4, "outcome": "discarded", "score": 0, "strategy": "template-default", "target": "four", "timestamp": "2026-05-07 03:13:52"}
{"axis": "?", "experiment-id": 1, "outcome": "discarded", "score": 0.7, "strategy": "template-default", "target": "one", "timestamp": "2026-05-07 03:13:52"}
{"axis": "?", "experiment-id": 1, "outcome": "kept", "score": 0.7, "strategy": "template-default", "target": "one", "timestamp": "2026-05-07 03:13:52"}
{"axis": "?", "experiment-id": 1, "outcome": "kept", "score": 0, "strategy": "template-default", "target": "one", "timestamp": "2026-05-07 03:13:52"}
{"axis": "?", "experiment-id": 2, "outcome": "kept", "score": 0, "strategy": "template-default", "target": "one", "timestamp": "2026-05-07 03:13:52"}
{"axis": "?", "experiment-id": 3, "outcome": "discarded", "score": 0, "strategy": "template-default", "target": "two", "timestamp": "2026-05-07 03:13:52"}
{"axis": "?", "experiment-id": 4, "outcome": "kept", "score": 0, "strategy": "template-default", "target": "two", "timestamp": "2026-05-07 03:13:52"}
{"axis": "?", "experiment-id": 1, "outcome": "kept", "score": 0.7, "strategy": "template-default", "target": "one", "timestamp": "2026-05-07 03:16:48"}
{"axis": "?", "experiment-id": 1, "outcome": "discarded", "score": 0.7, "strategy": "template-default", "target": "one", "timestamp": "2026-05-07 03:16:48"}
{"axis": "?", "experiment-id": 1, "outcome": "discarded", "score": 0, "strategy": "template-default", "target": "one", "timestamp": "2026-05-07 03:16:48"}
{"axis": "?", "experiment-id": 2, "outcome": "discarded", "score": 0, "strategy": "template-default", "target": "two", "timestamp": "2026-05-07 03:16:48"}
{"axis": "?", "experiment-id": 3, "outcome": "discarded", "score": 0, "strategy": "template-default", "target": "three", "timestamp": "2026-05-07 03:16:48"}
{"axis": "?", "experiment-id": 4, "outcome": "discarded", "score": 0, "strategy": "template-default", "target": "four", "timestamp": "2026-05-07 03:16:48"}
{"axis": "?", "experiment-id": 1, "outcome": "discarded", "score": 0.7, "strategy": "template-default", "target": "one", "timestamp": "2026-05-07 03:16:48"}
{"axis": "?", "experiment-id": 1, "outcome": "kept", "score": 0.7, "strategy": "template-default", "target": "one", "timestamp": "2026-05-07 03:16:48"}
{"axis": "?", "experiment-id": 1, "outcome": "kept", "score": 0, "strategy": "template-default", "target": "one", "timestamp": "2026-05-07 03:16:48"}
{"axis": "?", "experiment-id": 2, "outcome": "kept", "score": 0, "strategy": "template-default", "target": "one", "timestamp": "2026-05-07 03:16:48"}
{"axis": "?", "experiment-id": 3, "outcome": "discarded", "score": 0, "strategy": "template-default", "target": "two", "timestamp": "2026-05-07 03:16:48"}
{"axis": "?", "experiment-id": 4, "outcome": "kept", "score": 0, "strategy": "template-default", "target": "two", "timestamp": "2026-05-07 03:16:48"}
{"axis": "?", "experiment-id": 1, "outcome": "kept", "score": 0.39999999999999997, "strategy": "template-default", "target": "lisp/modules/gptel-tools-agent-error.el", "timestamp": "2026-05-07 03:17:30"}
{"axis": "?", "experiment-id": 2, "outcome": "discarded", "score": 0.39999999999999997, "strategy": "template-default", "target": "lisp/modules/gptel-tools-agent-error.el", "timestamp": "2026-05-07 03:21:11"}
{"axis": "?", "experiment-id": 3, "outcome": "discarded", "score": 0.39999999999999997, "strategy": "template-default", "target": "lisp/modules/gptel-tools-agent-error.el", "timestamp": "2026-05-07 03:27:41"}
{"axis": "?", "experiment-id": 4, "outcome": "discarded", "score": 0.39999999999999997, "strategy": "template-default", "target": "lisp/modules/gptel-tools-agent-error.el", "timestamp": "2026-05-07 03:40:48"}
{"axis": "?", "experiment-id": 1, "outcome": "discarded", "score": 0.39999999999999997, "strategy": "template-default", "target": "lisp/modules/gptel-ext-context.el", "timestamp": "2026-05-07 03:47:46"}
{"axis": "?", "experiment-id": 1, "outcome": "kept", "score": 0.7, "strategy": "template-default", "target": "one", "timestamp": "2026-05-07 03:49:19"}
{"axis": "?", "experiment-id": 1, "outcome": "discarded", "score": 0.7, "strategy": "template-default", "target": "one", "timestamp": "2026-05-07 03:49:19"}
{"axis": "?", "experiment-id": 1, "outcome": "discarded", "score": 0, "strategy": "template-default", "target": "one", "timestamp": "2026-05-07 03:49:19"}
{"axis": "?", "experiment-id": 2, "outcome": "discarded", "score": 0, "strategy": "template-default", "target": "two", "timestamp": "2026-05-07 03:49:19"}
{"axis": "?", "experiment-id": 3, "outcome": "discarded", "score": 0, "strategy": "template-default", "target": "three", "timestamp": "2026-05-07 03:49:19"}
{"axis": "?", "experiment-id": 4, "outcome": "discarded", "score": 0, "strategy": "template-default", "target": "four", "timestamp": "2026-05-07 03:49:19"}
{"axis": "?", "experiment-id": 1, "outcome": "discarded", "score": 0.7, "strategy": "template-default", "target": "one", "timestamp": "2026-05-07 03:49:19"}
{"axis": "?", "experiment-id": 1, "outcome": "kept", "score": 0.7, "strategy": "template-default", "target": "one", "timestamp": "2026-05-07 03:49:19"}
{"axis": "?", "experiment-id": 1, "outcome": "kept", "score": 0, "strategy": "template-default", "target": "one", "timestamp": "2026-05-07 03:49:19"}
{"axis": "?", "experiment-id": 2, "outcome": "kept", "score": 0, "strategy": "template-default", "target": "one", "timestamp": "2026-05-07 03:49:19"}
{"axis": "?", "experiment-id": 3, "outcome": "discarded", "score": 0, "strategy": "template-default", "target": "two", "timestamp": "2026-05-07 03:49:19"}
{"axis": "?", "experiment-id": 4, "outcome": "kept", "score": 0, "strategy": "template-default", "target": "two", "timestamp": "2026-05-07 03:49:19"}
{"axis": "?", "experiment-id": 1, "outcome": "kept", "score": 0.7, "strategy": "template-default", "target": "one", "timestamp": "2026-05-07 03:50:39"}
{"axis": "?", "experiment-id": 1, "outcome": "discarded", "score": 0.7, "strategy": "template-default", "target": "one", "timestamp": "2026-05-07 03:50:39"}
{"axis": "?", "experiment-id": 1, "outcome": "discarded", "score": 0, "strategy": "template-default", "target": "one", "timestamp": "2026-05-07 03:50:39"}
{"axis": "?", "experiment-id": 2, "outcome": "discarded", "score": 0, "strategy": "template-default", "target": "two", "timestamp": "2026-05-07 03:50:39"}
{"axis": "?", "experiment-id": 3, "outcome": "discarded", "score": 0, "strategy": "template-default", "target": "three", "timestamp": "2026-05-07 03:50:39"}
{"axis": "?", "experiment-id": 4, "outcome": "discarded", "score": 0, "strategy": "template-default", "target": "four", "timestamp": "2026-05-07 03:50:39"}
{"axis": "?", "experiment-id": 1, "outcome": "discarded", "score": 0.7, "strategy": "template-default", "target": "one", "timestamp": "2026-05-07 03:50:39"}
{"axis": "?", "experiment-id": 1, "outcome": "kept", "score": 0.7, "strategy": "template-default", "target": "one", "timestamp": "2026-05-07 03:50:39"}
{"axis": "?", "experiment-id": 1, "outcome": "kept", "score": 0, "strategy": "template-default", "target": "one", "timestamp": "2026-05-07 03:50:39"}
{"axis": "?", "experiment-id": 2, "outcome": "kept", "score": 0, "strategy": "template-default", "target": "one", "timestamp": "2026-05-07 03:50:39"}
{"axis": "?", "experiment-id": 3, "outcome": "discarded", "score": 0, "strategy": "template-default", "target": "two", "timestamp": "2026-05-07 03:50:39"}
{"axis": "?", "experiment-id": 4, "outcome": "kept", "score": 0, "strategy": "template-default", "target": "two", "timestamp": "2026-05-07 03:50:39"}
{"axis": "?", "experiment-id": 1, "outcome": "kept", "score": 0.39999999999999997, "strategy": "template-default", "target": "lisp/modules/gptel-ext-context.el", "timestamp": "2026-05-07 03:51:22"}
{"axis": "?", "experiment-id": 2, "outcome": "discarded", "score": 0.39999999999999997, "strategy": "template-default", "target": "lisp/modules/gptel-ext-context.el", "timestamp": "2026-05-07 03:59:47"}
{"axis": "?", "experiment-id": 3, "outcome": "discarded", "score": 0.39999999999999997, "strategy": "template-default", "target": "lisp/modules/gptel-ext-context.el", "timestamp": "2026-05-07 04:07:23"}
{"axis": "?", "experiment-id": 4, "outcome": "discarded", "score": 0.4125, "strategy": "template-default", "target": "lisp/modules/gptel-ext-context.el", "timestamp": "2026-05-07 04:12:20"}
{"axis": "?", "experiment-id": 1, "outcome": "kept", "score": 0.7, "strategy": "template-default", "target": "one", "timestamp": "2026-05-07 04:14:51"}
{"axis": "?", "experiment-id": 1, "outcome": "discarded", "score": 0.7, "strategy": "template-default", "target": "one", "timestamp": "2026-05-07 04:14:51"}
{"axis": "?", "experiment-id": 1, "outcome": "discarded", "score": 0, "strategy": "template-default", "target": "one", "timestamp": "2026-05-07 04:14:51"}
{"axis": "?", "experiment-id": 2, "outcome": "discarded", "score": 0, "strategy": "template-default", "target": "two", "timestamp": "2026-05-07 04:14:51"}
{"axis": "?", "experiment-id": 3, "outcome": "discarded", "score": 0, "strategy": "template-default", "target": "three", "timestamp": "2026-05-07 04:14:51"}
{"axis": "?", "experiment-id": 4, "outcome": "discarded", "score": 0, "strategy": "template-default", "target": "four", "timestamp": "2026-05-07 04:14:51"}
{"axis": "?", "experiment-id": 1, "outcome": "discarded", "score": 0.7, "strategy": "template-default", "target": "one", "timestamp": "2026-05-07 04:14:51"}
{"axis": "?", "experiment-id": 1, "outcome": "kept", "score": 0.7, "strategy": "template-default", "target": "one", "timestamp": "2026-05-07 04:14:51"}
{"axis": "?", "experiment-id": 1, "outcome": "kept", "score": 0, "strategy": "template-default", "target": "one", "timestamp": "2026-05-07 04:14:51"}
{"axis": "?", "experiment-id": 2, "outcome": "kept", "score": 0, "strategy": "template-default", "target": "one", "timestamp": "2026-05-07 04:14:51"}
{"axis": "?", "experiment-id": 3, "outcome": "discarded", "score": 0, "strategy": "template-default", "target": "two", "timestamp": "2026-05-07 04:14:51"}
{"axis": "?", "experiment-id": 4, "outcome": "kept", "score": 0, "strategy": "template-default", "target": "two", "timestamp": "2026-05-07 04:14:51"}
{"axis": "?", "experiment-id": 4, "outcome": "kept", "score": 0.4125, "strategy": "template-default", "target": "lisp/modules/gptel-ext-context.el", "timestamp": "2026-05-07 04:15:33"}
{"axis": "?", "experiment-id": 5, "outcome": "discarded", "score": 0.39999999999999997, "strategy": "template-default", "target": "lisp/modules/gptel-ext-context.el", "timestamp": "2026-05-07 04:21:31"}
{"axis": "?", "experiment-id": 6, "outcome": "discarded", "score": 0.39999999999999997, "strategy": "template-default", "target": "lisp/modules/gptel-ext-context.el", "timestamp": "2026-05-07 04:24:51"}
{"axis": "?", "experiment-id": 7, "outcome": "discarded", "score": 0, "strategy": "template-default", "target": "lisp/modules/gptel-ext-context.el", "timestamp": "2026-05-07 04:31:05"}
{"axis": "?", "experiment-id": 1, "outcome": "discarded", "score": 0.39999999999999997, "strategy": "template-default", "target": "lisp/modules/gptel-ext-fsm.el", "timestamp": "2026-05-07 04:34:35"}
{"axis": "?", "experiment-id": 1, "outcome": "kept", "score": 0.7, "strategy": "template-default", "target": "one", "timestamp": "2026-05-07 04:37:10"}
{"axis": "?", "experiment-id": 1, "outcome": "discarded", "score": 0.7, "strategy": "template-default", "target": "one", "timestamp": "2026-05-07 04:37:10"}
{"axis": "?", "experiment-id": 1, "outcome": "discarded", "score": 0, "strategy": "template-default", "target": "one", "timestamp": "2026-05-07 04:37:10"}
{"axis": "?", "experiment-id": 2, "outcome": "discarded", "score": 0, "strategy": "template-default", "target": "two", "timestamp": "2026-05-07 04:37:10"}
{"axis": "?", "experiment-id": 3, "outcome": "discarded", "score": 0, "strategy": "template-default", "target": "three", "timestamp": "2026-05-07 04:37:10"}
{"axis": "?", "experiment-id": 4, "outcome": "discarded", "score": 0, "strategy": "template-default", "target": "four", "timestamp": "2026-05-07 04:37:10"}
{"axis": "?", "experiment-id": 1, "outcome": "discarded", "score": 0.7, "strategy": "template-default", "target": "one", "timestamp": "2026-05-07 04:37:10"}
{"axis": "?", "experiment-id": 1, "outcome": "kept", "score": 0.7, "strategy": "template-default", "target": "one", "timestamp": "2026-05-07 04:37:10"}
{"axis": "?", "experiment-id": 1, "outcome": "kept", "score": 0, "strategy": "template-default", "target": "one", "timestamp": "2026-05-07 04:37:10"}
{"axis": "?", "experiment-id": 2, "outcome": "kept", "score": 0, "strategy": "template-default", "target": "one", "timestamp": "2026-05-07 04:37:10"}
{"axis": "?", "experiment-id": 3, "outcome": "discarded", "score": 0, "strategy": "template-default", "target": "two", "timestamp": "2026-05-07 04:37:10"}
{"axis": "?", "experiment-id": 4, "outcome": "kept", "score": 0, "strategy": "template-default", "target": "two", "timestamp": "2026-05-07 04:37:10"}
{"axis": "?", "experiment-id": 1, "outcome": "kept", "score": 0.7, "strategy": "template-default", "target": "one", "timestamp": "2026-05-07 04:40:08"}
{"axis": "?", "experiment-id": 1, "outcome": "discarded", "score": 0.7, "strategy": "template-default", "target": "one", "timestamp": "2026-05-07 04:40:08"}
{"axis": "?", "experiment-id": 1, "outcome": "discarded", "score": 0, "strategy": "template-default", "target": "one", "timestamp": "2026-05-07 04:40:08"}
{"axis": "?", "experiment-id": 2, "outcome": "discarded", "score": 0, "strategy": "template-default", "target": "two", "timestamp": "2026-05-07 04:40:08"}
{"axis": "?", "experiment-id": 3, "outcome": "discarded", "score": 0, "strategy": "template-default", "target": "three", "timestamp": "2026-05-07 04:40:08"}
{"axis": "?", "experiment-id": 4, "outcome": "discarded", "score": 0, "strategy": "template-default", "target": "four", "timestamp": "2026-05-07 04:40:08"}
{"axis": "?", "experiment-id": 1, "outcome": "discarded", "score": 0.7, "strategy": "template-default", "target": "one", "timestamp": "2026-05-07 04:40:08"}
{"axis": "?", "experiment-id": 1, "outcome": "kept", "score": 0.7, "strategy": "template-default", "target": "one", "timestamp": "2026-05-07 04:40:08"}
{"axis": "?", "experiment-id": 1, "outcome": "kept", "score": 0, "strategy": "template-default", "target": "one", "timestamp": "2026-05-07 04:40:08"}
{"axis": "?", "experiment-id": 2, "outcome": "kept", "score": 0, "strategy": "template-default", "target": "one", "timestamp": "2026-05-07 04:40:08"}
{"axis": "?", "experiment-id": 3, "outcome": "discarded", "score": 0, "strategy": "template-default", "target": "two", "timestamp": "2026-05-07 04:40:08"}
