{"axis": "?", "experiment-id": 1, "outcome": "kept", "score": 0.7, "strategy": "template-default", "target": "one", "timestamp": "2026-05-08 15:27:11"}
{"axis": "?", "experiment-id": 1, "outcome": "discarded", "score": 0.7, "strategy": "template-default", "target": "one", "timestamp": "2026-05-08 15:27:11"}
{"axis": "?", "experiment-id": 1, "outcome": "discarded", "score": 0, "strategy": "template-default", "target": "one", "timestamp": "2026-05-08 15:27:11"}
{"axis": "?", "experiment-id": 2, "outcome": "discarded", "score": 0, "strategy": "template-default", "target": "two", "timestamp": "2026-05-08 15:27:11"}
{"axis": "?", "experiment-id": 3, "outcome": "discarded", "score": 0, "strategy": "template-default", "target": "three", "timestamp": "2026-05-08 15:27:11"}
{"axis": "?", "experiment-id": 4, "outcome": "discarded", "score": 0, "strategy": "template-default", "target": "four", "timestamp": "2026-05-08 15:27:11"}
{"axis": "?", "experiment-id": 1, "outcome": "discarded", "score": 0.7, "strategy": "template-default", "target": "one", "timestamp": "2026-05-08 15:27:11"}
{"axis": "?", "experiment-id": 1, "outcome": "kept", "score": 0.7, "strategy": "template-default", "target": "one", "timestamp": "2026-05-08 15:27:11"}
{"axis": "?", "experiment-id": 1, "outcome": "kept", "score": 0, "strategy": "template-default", "target": "one", "timestamp": "2026-05-08 15:27:11"}
{"axis": "?", "experiment-id": 2, "outcome": "kept", "score": 0, "strategy": "template-default", "target": "one", "timestamp": "2026-05-08 15:27:11"}
{"axis": "?", "experiment-id": 3, "outcome": "discarded", "score": 0, "strategy": "template-default", "target": "two", "timestamp": "2026-05-08 15:27:11"}
{"axis": "?", "experiment-id": 4, "outcome": "kept", "score": 0, "strategy": "template-default", "target": "two", "timestamp": "2026-05-08 15:27:11"}
{"axis": "?", "experiment-id": 5, "outcome": "discarded", "score": 0, "strategy": "template-default", "target": "lisp/modules/gptel-auto-workflow-strategic.el", "timestamp": "2026-05-08 15:29:04"}
{"axis": "?", "experiment-id": 1, "outcome": "discarded", "score": 0, "strategy": "template-default", "target": "lisp/modules/gptel-ext-context.el", "timestamp": "2026-05-08 15:34:44"}
{"axis": "?", "experiment-id": 1, "outcome": "discarded", "score": 0, "strategy": "template-default", "target": "lisp/modules/gptel-agent-loop.el", "timestamp": "2026-05-09 15:33:20"}
{"axis": "?", "experiment-id": 2, "outcome": "discarded", "score": 0, "strategy": "template-default", "target": "lisp/modules/gptel-agent-loop.el", "timestamp": "2026-05-09 15:48:01"}
{"axis": "?", "experiment-id": 3, "outcome": "discarded", "score": 0, "strategy": "template-default", "target": "lisp/modules/gptel-agent-loop.el", "timestamp": "2026-05-09 15:49:58"}
{"axis": "?", "experiment-id": 1, "outcome": "discarded", "score": 0, "strategy": "template-default", "target": "lisp/modules/gptel-tools-agent.el", "timestamp": "2026-05-09 16:54:17"}
{"axis": "?", "experiment-id": 2, "outcome": "discarded", "score": 0, "strategy": "template-default", "target": "lisp/modules/gptel-tools-agent.el", "timestamp": "2026-05-09 17:18:20"}
{"axis": "?", "experiment-id": 3, "outcome": "discarded", "score": 0, "strategy": "template-default", "target": "lisp/modules/gptel-tools-agent.el", "timestamp": "2026-05-09 17:20:11"}
{"axis": "?", "experiment-id": 1, "outcome": "discarded", "score": 0.43333333333333335, "strategy": "template-default", "target": "lisp/modules/gptel-tools-agent.el", "timestamp": "2026-05-09 18:04:53"}
{"axis": "?", "experiment-id": 1, "outcome": "kept", "score": 0.43333333333333335, "strategy": "template-default", "target": "lisp/modules/gptel-tools-agent.el", "timestamp": "2026-05-09 18:07:26"}
{"axis": "?", "experiment-id": 2, "outcome": "discarded", "score": 0, "strategy": "template-default", "target": "lisp/modules/gptel-tools-agent.el", "timestamp": "2026-05-09 18:44:51"}
{"axis": "?", "experiment-id": 1, "outcome": "discarded", "score": 0.4000000000000001, "strategy": "template-default", "target": "lisp/modules/gptel-auto-workflow-projects.el", "timestamp": "2026-05-09 20:27:26"}
{"axis": "?", "experiment-id": 1, "outcome": "kept", "score": 0.4000000000000001, "strategy": "template-default", "target": "lisp/modules/gptel-auto-workflow-projects.el", "timestamp": "2026-05-09 20:29:03"}
{"axis": "?", "experiment-id": 2, "outcome": "discarded", "score": 0.4000000000000001, "strategy": "template-default", "target": "lisp/modules/gptel-auto-workflow-projects.el", "timestamp": "2026-05-09 20:35:40"}
{"axis": "?", "experiment-id": 3, "outcome": "discarded", "score": 0.4000000000000001, "strategy": "template-default", "target": "lisp/modules/gptel-auto-workflow-projects.el", "timestamp": "2026-05-09 20:45:56"}
{"axis": "?", "experiment-id": 4, "outcome": "discarded", "score": 0.4, "strategy": "template-default", "target": "lisp/modules/gptel-auto-workflow-projects.el", "timestamp": "2026-05-09 20:54:14"}
{"axis": "?", "experiment-id": 1, "outcome": "discarded", "score": 0.4000000000000001, "strategy": "template-default", "target": "lisp/modules/gptel-sandbox.el", "timestamp": "2026-05-09 21:09:36"}
{"axis": "?", "experiment-id": 1, "outcome": "kept", "score": 0.4000000000000001, "strategy": "template-default", "target": "lisp/modules/gptel-sandbox.el", "timestamp": "2026-05-09 21:11:39"}
{"axis": "?", "experiment-id": 1, "outcome": "discarded", "score": 0, "strategy": "template-default", "target": "lisp/modules/gptel-tools-agent.el", "timestamp": "2026-05-09 18:05:50"}
{"axis": "?", "experiment-id": 2, "outcome": "discarded", "score": 0, "strategy": "template-default", "target": "lisp/modules/gptel-tools-agent.el", "timestamp": "2026-05-09 18:38:36"}
{"axis": "?", "experiment-id": 3, "outcome": "discarded", "score": 0, "strategy": "template-default", "target": "lisp/modules/gptel-tools-agent.el", "timestamp": "2026-05-09 18:40:24"}
{"axis": "?", "experiment-id": 1, "outcome": "discarded", "score": 0, "strategy": "template-default", "target": "lisp/modules/gptel-auto-workflow-projects.el", "timestamp": "2026-05-09 19:35:25"}
{"axis": "?", "experiment-id": 2, "outcome": "discarded", "score": 0, "strategy": "template-default", "target": "lisp/modules/gptel-auto-workflow-projects.el", "timestamp": "2026-05-09 19:58:54"}
{"axis": "?", "experiment-id": 3, "outcome": "discarded", "score": 0, "strategy": "template-default", "target": "lisp/modules/gptel-auto-workflow-projects.el", "timestamp": "2026-05-09 20:00:47"}
{"timestamp":"2026-05-09 22:54:48","strategy":"template-default","target":"lisp/modules/gptel-auto-workflow-projects.el","experiment-id":1,"score":0,"outcome":"discarded","axis":"?"}
{"timestamp":"2026-05-09 23:40:01","strategy":"template-default","target":"lisp/modules/gptel-auto-workflow-projects.el","experiment-id":1,"score":0,"outcome":"discarded","axis":"?"}
{"timestamp":"2026-05-10 00:13:13","strategy":"template-default","target":"lisp/modules/gptel-auto-workflow-projects.el","experiment-id":2,"score":0,"outcome":"discarded","axis":"?"}
{"timestamp":"2026-05-10 00:45:55","strategy":"template-default","target":"lisp/modules/gptel-auto-workflow-projects.el","experiment-id":3,"score":0,"outcome":"discarded","axis":"?"}
{"timestamp":"2026-05-10 01:17:17","strategy":"template-default","target":"lisp/modules/gptel-ext-tool-sanitize.el","experiment-id":1,"score":0,"outcome":"discarded","axis":"?"}
{"timestamp":"2026-05-10 01:50:34","strategy":"template-default","target":"lisp/modules/gptel-ext-tool-sanitize.el","experiment-id":2,"score":0,"outcome":"discarded","axis":"?"}
{"timestamp":"2026-05-10 02:23:26","strategy":"template-default","target":"lisp/modules/gptel-ext-tool-sanitize.el","experiment-id":3,"score":0,"outcome":"discarded","axis":"?"}
{"timestamp":"2026-05-10 02:54:50","strategy":"template-default","target":"lisp/modules/gptel-sandbox.el","experiment-id":1,"score":0,"outcome":"discarded","axis":"?"}
{"timestamp":"2026-05-10 03:26:38","strategy":"template-default","target":"lisp/modules/gptel-sandbox.el","experiment-id":2,"score":0,"outcome":"discarded","axis":"?"}
{"timestamp":"2026-05-10 03:59:10","strategy":"template-default","target":"lisp/modules/gptel-sandbox.el","experiment-id":3,"score":0,"outcome":"discarded","axis":"?"}
{"timestamp":"2026-05-10 04:29:49","strategy":"template-default","target":"lisp/modules/gptel-benchmark-core.el","experiment-id":1,"score":0,"outcome":"discarded","axis":"?"}
{"timestamp":"2026-05-10 05:01:28","strategy":"template-default","target":"lisp/modules/gptel-benchmark-core.el","experiment-id":2,"score":0,"outcome":"discarded","axis":"?"}
{"timestamp":"2026-05-10 05:33:06","strategy":"template-default","target":"lisp/modules/gptel-benchmark-core.el","experiment-id":3,"score":0,"outcome":"discarded","axis":"?"}
{"timestamp":"2026-05-10 06:03:47","strategy":"template-default","target":"lisp/modules/gptel-tools-agent-benchmark.el","experiment-id":1,"score":0,"outcome":"discarded","axis":"?"}
{"timestamp":"2026-05-10 06:35:50","strategy":"template-default","target":"lisp/modules/gptel-tools-agent-benchmark.el","experiment-id":2,"score":0,"outcome":"discarded","axis":"?"}
{"timestamp":"2026-05-10 07:07:52","strategy":"template-default","target":"lisp/modules/gptel-tools-agent-benchmark.el","experiment-id":3,"score":0,"outcome":"discarded","axis":"?"}
{"timestamp":"2026-05-10 07:42:09","strategy":"template-default","target":"lisp/modules/gptel-auto-workflow-projects.el","experiment-id":1,"score":0,"outcome":"discarded","axis":"?"}
{"timestamp":"2026-05-10 08:14:50","strategy":"template-default","target":"lisp/modules/gptel-auto-workflow-projects.el","experiment-id":2,"score":0,"outcome":"discarded","axis":"?"}
{"timestamp":"2026-05-10 09:04:40","strategy":"template-default","target":"lisp/modules/gptel-tools-agent.el","experiment-id":1,"score":0,"outcome":"discarded","axis":"?"}
<<<<<<< Updated upstream
{"timestamp":"2026-05-10 09:53:20","strategy":"template-default","target":"lisp/modules/gptel-benchmark-evolution.el","experiment-id":1,"score":0,"outcome":"discarded","axis":"?"}
{"timestamp":"2026-05-10 10:53:11","strategy":"template-default","target":"lisp/modules/gptel-tools-agent.el","experiment-id":1,"score":0,"outcome":"discarded","axis":"?"}
{"timestamp":"2026-05-10 11:44:44","strategy":"template-default","target":"lisp/modules/gptel-auto-workflow-projects.el","experiment-id":1,"score":0,"outcome":"discarded","axis":"?"}
{"timestamp":"2026-05-10 11:56:05","strategy":"template-default","target":"lisp/modules/gptel-auto-workflow-projects.el","experiment-id":2,"score":0,"outcome":"discarded","axis":"?"}
{"timestamp":"2026-05-10 12:14:17","strategy":"template-default","target":"lisp/modules/gptel-auto-workflow-projects.el","experiment-id":1,"score":0,"outcome":"discarded","axis":"?"}
{"timestamp":"2026-05-10 12:38:22","strategy":"template-default","target":"lisp/modules/gptel-tools-agent.el","experiment-id":1,"score":0,"outcome":"discarded","axis":"?"}
{"timestamp":"2026-05-10 12:49:35","strategy":"template-default","target":"lisp/modules/gptel-tools-agent.el","experiment-id":2,"score":0,"outcome":"discarded","axis":"?"}
{"timestamp":"2026-05-10 12:59:28","strategy":"template-default","target":"lisp/modules/gptel-tools-agent.el","experiment-id":3,"score":0,"outcome":"discarded","axis":"?"}
{"timestamp":"2026-05-10 13:01:35","strategy":"template-default","target":"lisp/modules/gptel-auto-workflow-strategic.el","experiment-id":1,"score":0,"outcome":"discarded","axis":"?"}
{"timestamp":"2026-05-10 13:04:43","strategy":"template-default","target":"lisp/modules/gptel-auto-workflow-strategic.el","experiment-id":2,"score":0,"outcome":"discarded","axis":"?"}
{"timestamp":"2026-05-10 09:25:48","strategy":"evolved-0001","target":"lisp/modules/gptel-auto-workflow-strategic.el","experiment-id":1,"score":0.4,"outcome":"discarded","axis":"?"}
{"timestamp":"2026-05-10 09:50:49","strategy":"section-reorder","target":"lisp/modules/gptel-auto-workflow-projects.el","experiment-id":1,"score":0.4,"outcome":"discarded","axis":"?"}
{"timestamp":"2026-05-10 09:51:35","strategy":"section-reorder","target":"lisp/modules/gptel-auto-workflow-projects.el","experiment-id":1,"score":0.4,"outcome":"kept","axis":"?"}
{"timestamp":"2026-05-10 09:57:12","strategy":"candidate-section-re-1","target":"lisp/modules/gptel-auto-workflow-projects.el","experiment-id":2,"score":0.42500000000000004,"outcome":"discarded","axis":"?"}
{"timestamp":"2026-05-10 09:57:52","strategy":"candidate-section-re-1","target":"lisp/modules/gptel-auto-workflow-projects.el","experiment-id":2,"score":0.42500000000000004,"outcome":"kept","axis":"?"}
{"timestamp":"2026-05-10 10:02:49","strategy":"template-default","target":"lisp/modules/gptel-auto-workflow-projects.el","experiment-id":3,"score":0,"outcome":"discarded","axis":"?"}
{"timestamp":"2026-05-10 10:12:00","strategy":"template-default","target":"lisp/modules/gptel-auto-workflow-projects.el","experiment-id":4,"score":0,"outcome":"discarded","axis":"?"}
{"timestamp":"2026-05-10 10:16:47","strategy":"template-default","target":"lisp/modules/gptel-auto-workflow-projects.el","experiment-id":5,"score":0,"outcome":"discarded","axis":"?"}
{"timestamp":"2026-05-10 11:17:02","strategy":"template-default","target":"lisp/modules/gptel-ext-tool-sanitize.el","experiment-id":1,"score":0,"outcome":"discarded","axis":"?"}
{"timestamp":"2026-05-10 11:26:23","strategy":"template-default","target":"lisp/modules/gptel-ext-tool-sanitize.el","experiment-id":2,"score":0,"outcome":"discarded","axis":"?"}
{"timestamp":"2026-05-10 11:44:59","strategy":"template-default","target":"lisp/modules/gptel-ext-tool-sanitize.el","experiment-id":3,"score":0,"outcome":"discarded","axis":"?"}
{"timestamp":"2026-05-10 11:46:53","strategy":"template-default","target":"lisp/modules/gptel-auto-workflow-projects.el","experiment-id":1,"score":0,"outcome":"discarded","axis":"?"}
{"timestamp":"2026-05-10 14:01:42","strategy":"candidate-section-re-3","target":"lisp/modules/gptel-tools-agent.el","experiment-id":1,"score":0.4000000000000001,"outcome":"discarded","axis":"?"}
{"timestamp":"2026-05-10 14:02:42","strategy":"candidate-section-re-3","target":"lisp/modules/gptel-tools-agent.el","experiment-id":1,"score":0.4000000000000001,"outcome":"kept","axis":"?"}
{"timestamp":"2026-05-10 14:11:36","strategy":"candidate-section-re-1","target":"lisp/modules/gptel-tools-agent.el","experiment-id":2,"score":0.4,"outcome":"discarded","axis":"?"}
{"timestamp":"2026-05-10 14:30:27","strategy":"template-default","target":"lisp/modules/gptel-tools-agent.el","experiment-id":1,"score":0,"outcome":"discarded","axis":"?"}
{"timestamp":"2026-05-10 14:59:59","strategy":"template-default","target":"lisp/modules/gptel-auto-workflow-projects.el","experiment-id":1,"score":0,"outcome":"discarded","axis":"?"}
{"timestamp":"2026-05-10 15:28:53","strategy":"template-default","target":"lisp/modules/gptel-auto-workflow-projects.el","experiment-id":2,"score":0,"outcome":"discarded","axis":"?"}
{"timestamp":"2026-05-10 15:32:01","strategy":"template-default","target":"lisp/modules/gptel-auto-workflow-projects.el","experiment-id":3,"score":0,"outcome":"discarded","axis":"?"}
{"timestamp":"2026-05-10 15:34:56","strategy":"template-default","target":"lisp/modules/gptel-sandbox.el","experiment-id":1,"score":0,"outcome":"discarded","axis":"?"}
{"timestamp":"2026-05-10 15:57:28","strategy":"candidate-candidate--1","target":"lisp/modules/gptel-sandbox.el","experiment-id":2,"score":0.4000000000000001,"outcome":"discarded","axis":"?"}
{"timestamp":"2026-05-10 16:06:17","strategy":"template-default","target":"lisp/modules/gptel-sandbox.el","experiment-id":3,"score":0,"outcome":"discarded","axis":"?"}
{"timestamp":"2026-05-10 16:01:31","strategy":"template-default","target":"lisp/modules/gptel-tools-agent.el","experiment-id":1,"score":0,"outcome":"discarded","axis":"?"}
{"timestamp":"2026-05-10 16:24:40","strategy":"template-default","target":"lisp/modules/gptel-tools-agent.el","experiment-id":2,"score":0,"outcome":"discarded","axis":"?"}
{"timestamp":"2026-05-10 16:27:51","strategy":"template-default","target":"lisp/modules/gptel-tools-agent.el","experiment-id":3,"score":0,"outcome":"discarded","axis":"?"}
{"timestamp":"2026-05-10 16:30:54","strategy":"template-default","target":"lisp/modules/gptel-auto-workflow-strategic.el","experiment-id":1,"score":0,"outcome":"discarded","axis":"?"}
{"timestamp":"2026-05-10 17:03:59","strategy":"candidate-template-d-3","target":"lisp/modules/gptel-tools-agent.el","experiment-id":1,"score":0.4,"outcome":"discarded","axis":"A"}
{"timestamp":"2026-05-10 17:26:32","strategy":"candidate-section-re-3","target":"lisp/modules/gptel-tools-agent.el","experiment-id":2,"score":0.4000000000000001,"outcome":"discarded","axis":"A"}
{"timestamp":"2026-05-10 17:42:06","strategy":"template-default","target":"lisp/modules/gptel-tools-agent.el","experiment-id":3,"score":0,"outcome":"discarded","axis":"?"}
