{"axis": "?", "experiment-id": 4, "outcome": "discarded", "score": 0, "strategy": "template-default", "target": "four", "timestamp": "2026-05-04 15:51:55"}
{"axis": "?", "experiment-id": 1, "outcome": "discarded", "score": 0.7, "strategy": "template-default", "target": "one", "timestamp": "2026-05-04 15:51:55"}
{"axis": "?", "experiment-id": 1, "outcome": "kept", "score": 0.7, "strategy": "template-default", "target": "one", "timestamp": "2026-05-04 15:51:55"}
{"axis": "?", "experiment-id": 1, "outcome": "kept", "score": 0, "strategy": "template-default", "target": "one", "timestamp": "2026-05-04 15:51:55"}
{"axis": "?", "experiment-id": 2, "outcome": "kept", "score": 0, "strategy": "template-default", "target": "one", "timestamp": "2026-05-04 15:51:55"}
{"axis": "?", "experiment-id": 3, "outcome": "discarded", "score": 0, "strategy": "template-default", "target": "two", "timestamp": "2026-05-04 15:51:55"}
{"axis": "?", "experiment-id": 4, "outcome": "kept", "score": 0, "strategy": "template-default", "target": "two", "timestamp": "2026-05-04 15:51:55"}
{"axis": "?", "experiment-id": 1, "outcome": "kept", "score": 0.7, "strategy": "template-default", "target": "one", "timestamp": "2026-05-04 15:54:06"}
{"axis": "?", "experiment-id": 1, "outcome": "discarded", "score": 0.7, "strategy": "template-default", "target": "one", "timestamp": "2026-05-04 15:54:06"}
{"axis": "?", "experiment-id": 1, "outcome": "discarded", "score": 0, "strategy": "template-default", "target": "one", "timestamp": "2026-05-04 15:54:06"}
{"axis": "?", "experiment-id": 2, "outcome": "discarded", "score": 0, "strategy": "template-default", "target": "two", "timestamp": "2026-05-04 15:54:06"}
{"axis": "?", "experiment-id": 3, "outcome": "discarded", "score": 0, "strategy": "template-default", "target": "three", "timestamp": "2026-05-04 15:54:06"}
{"axis": "?", "experiment-id": 4, "outcome": "discarded", "score": 0, "strategy": "template-default", "target": "four", "timestamp": "2026-05-04 15:54:06"}
{"axis": "?", "experiment-id": 1, "outcome": "discarded", "score": 0.7, "strategy": "template-default", "target": "one", "timestamp": "2026-05-04 15:54:06"}
{"axis": "?", "experiment-id": 1, "outcome": "kept", "score": 0.7, "strategy": "template-default", "target": "one", "timestamp": "2026-05-04 15:54:06"}
{"axis": "?", "experiment-id": 1, "outcome": "kept", "score": 0, "strategy": "template-default", "target": "one", "timestamp": "2026-05-04 15:54:06"}
{"axis": "?", "experiment-id": 2, "outcome": "kept", "score": 0, "strategy": "template-default", "target": "one", "timestamp": "2026-05-04 15:54:06"}
{"axis": "?", "experiment-id": 3, "outcome": "discarded", "score": 0, "strategy": "template-default", "target": "two", "timestamp": "2026-05-04 15:54:06"}
{"axis": "?", "experiment-id": 4, "outcome": "kept", "score": 0, "strategy": "template-default", "target": "two", "timestamp": "2026-05-04 15:54:06"}
{"axis": "?", "experiment-id": 0, "outcome": "discarded", "score": 0, "strategy": "template-default", "target": "staging-verification", "timestamp": "2026-05-04 15:54:48"}
{"axis": "?", "experiment-id": 1, "outcome": "discarded", "score": 0.39999999999999997, "strategy": "weighted-skills", "target": "lisp/modules/gptel-tools-agent-worktree.el", "timestamp": "2026-05-04 15:54:49"}
{"axis": "?", "experiment-id": 2, "outcome": "discarded", "score": 0.39999999999999997, "strategy": "weighted-skills", "target": "lisp/modules/gptel-tools-agent-worktree.el", "timestamp": "2026-05-04 16:00:40"}
{"axis": "?", "experiment-id": 1, "outcome": "kept", "score": 0.7, "strategy": "template-default", "target": "one", "timestamp": "2026-05-04 16:02:40"}
{"axis": "?", "experiment-id": 1, "outcome": "discarded", "score": 0.7, "strategy": "template-default", "target": "one", "timestamp": "2026-05-04 16:02:40"}
{"axis": "?", "experiment-id": 1, "outcome": "discarded", "score": 0, "strategy": "template-default", "target": "one", "timestamp": "2026-05-04 16:02:40"}
{"axis": "?", "experiment-id": 2, "outcome": "discarded", "score": 0, "strategy": "template-default", "target": "two", "timestamp": "2026-05-04 16:02:40"}
{"axis": "?", "experiment-id": 3, "outcome": "discarded", "score": 0, "strategy": "template-default", "target": "three", "timestamp": "2026-05-04 16:02:40"}
{"axis": "?", "experiment-id": 4, "outcome": "discarded", "score": 0, "strategy": "template-default", "target": "four", "timestamp": "2026-05-04 16:02:40"}
{"axis": "?", "experiment-id": 1, "outcome": "discarded", "score": 0.7, "strategy": "template-default", "target": "one", "timestamp": "2026-05-04 16:02:40"}
{"axis": "?", "experiment-id": 1, "outcome": "kept", "score": 0.7, "strategy": "template-default", "target": "one", "timestamp": "2026-05-04 16:02:40"}
{"axis": "?", "experiment-id": 1, "outcome": "kept", "score": 0, "strategy": "template-default", "target": "one", "timestamp": "2026-05-04 16:02:40"}
{"axis": "?", "experiment-id": 2, "outcome": "kept", "score": 0, "strategy": "template-default", "target": "one", "timestamp": "2026-05-04 16:02:40"}
{"axis": "?", "experiment-id": 3, "outcome": "discarded", "score": 0, "strategy": "template-default", "target": "two", "timestamp": "2026-05-04 16:02:40"}
{"axis": "?", "experiment-id": 4, "outcome": "kept", "score": 0, "strategy": "template-default", "target": "two", "timestamp": "2026-05-04 16:02:40"}
{"axis": "?", "experiment-id": 2, "outcome": "kept", "score": 0.39999999999999997, "strategy": "weighted-skills", "target": "lisp/modules/gptel-tools-agent-worktree.el", "timestamp": "2026-05-04 16:03:22"}
{"axis": "?", "experiment-id": 3, "outcome": "discarded", "score": 0.4125, "strategy": "weighted-skills", "target": "lisp/modules/gptel-tools-agent-worktree.el", "timestamp": "2026-05-04 16:09:12"}
{"axis": "?", "experiment-id": 1, "outcome": "kept", "score": 0.7, "strategy": "template-default", "target": "one", "timestamp": "2026-05-04 16:11:11"}
{"axis": "?", "experiment-id": 1, "outcome": "discarded", "score": 0.7, "strategy": "template-default", "target": "one", "timestamp": "2026-05-04 16:11:11"}
{"axis": "?", "experiment-id": 1, "outcome": "discarded", "score": 0, "strategy": "template-default", "target": "one", "timestamp": "2026-05-04 16:11:11"}
{"axis": "?", "experiment-id": 2, "outcome": "discarded", "score": 0, "strategy": "template-default", "target": "two", "timestamp": "2026-05-04 16:11:12"}
{"axis": "?", "experiment-id": 3, "outcome": "discarded", "score": 0, "strategy": "template-default", "target": "three", "timestamp": "2026-05-04 16:11:12"}
{"axis": "?", "experiment-id": 4, "outcome": "discarded", "score": 0, "strategy": "template-default", "target": "four", "timestamp": "2026-05-04 16:11:12"}
{"axis": "?", "experiment-id": 1, "outcome": "discarded", "score": 0.7, "strategy": "template-default", "target": "one", "timestamp": "2026-05-04 16:11:12"}
{"axis": "?", "experiment-id": 1, "outcome": "kept", "score": 0.7, "strategy": "template-default", "target": "one", "timestamp": "2026-05-04 16:11:12"}
{"axis": "?", "experiment-id": 1, "outcome": "kept", "score": 0, "strategy": "template-default", "target": "one", "timestamp": "2026-05-04 16:11:12"}
{"axis": "?", "experiment-id": 2, "outcome": "kept", "score": 0, "strategy": "template-default", "target": "one", "timestamp": "2026-05-04 16:11:12"}
{"axis": "?", "experiment-id": 3, "outcome": "discarded", "score": 0, "strategy": "template-default", "target": "two", "timestamp": "2026-05-04 16:11:12"}
{"axis": "?", "experiment-id": 4, "outcome": "kept", "score": 0, "strategy": "template-default", "target": "two", "timestamp": "2026-05-04 16:11:12"}
{"axis": "?", "experiment-id": 3, "outcome": "kept", "score": 0.4125, "strategy": "weighted-skills", "target": "lisp/modules/gptel-tools-agent-worktree.el", "timestamp": "2026-05-04 16:11:54"}
{"axis": "?", "experiment-id": 4, "outcome": "discarded", "score": 0.39999999999999997, "strategy": "weighted-skills", "target": "lisp/modules/gptel-tools-agent-worktree.el", "timestamp": "2026-05-04 16:16:05"}
{"axis": "?", "experiment-id": 5, "outcome": "discarded", "score": 0.39999999999999997, "strategy": "weighted-skills", "target": "lisp/modules/gptel-tools-agent-worktree.el", "timestamp": "2026-05-04 16:23:34"}
{"axis": "?", "experiment-id": 1, "outcome": "discarded", "score": 0, "strategy": "template-default", "target": "lisp/modules/gptel-auto-workflow-strategic.el", "timestamp": "2026-05-04 16:28:56"}
{"axis": "?", "experiment-id": 2, "outcome": "discarded", "score": 0.3916666666666666, "strategy": "weighted-skills", "target": "lisp/modules/gptel-auto-workflow-strategic.el", "timestamp": "2026-05-04 16:35:14"}
{"axis": "?", "experiment-id": 1, "outcome": "kept", "score": 0.7, "strategy": "template-default", "target": "one", "timestamp": "2026-05-04 16:37:06"}
{"axis": "?", "experiment-id": 1, "outcome": "discarded", "score": 0.7, "strategy": "template-default", "target": "one", "timestamp": "2026-05-04 16:37:06"}
{"axis": "?", "experiment-id": 1, "outcome": "discarded", "score": 0, "strategy": "template-default", "target": "one", "timestamp": "2026-05-04 16:37:06"}
{"axis": "?", "experiment-id": 2, "outcome": "discarded", "score": 0, "strategy": "template-default", "target": "two", "timestamp": "2026-05-04 16:37:06"}
{"axis": "?", "experiment-id": 3, "outcome": "discarded", "score": 0, "strategy": "template-default", "target": "three", "timestamp": "2026-05-04 16:37:06"}
{"axis": "?", "experiment-id": 4, "outcome": "discarded", "score": 0, "strategy": "template-default", "target": "four", "timestamp": "2026-05-04 16:37:06"}
{"axis": "?", "experiment-id": 1, "outcome": "discarded", "score": 0.7, "strategy": "template-default", "target": "one", "timestamp": "2026-05-04 16:37:06"}
{"axis": "?", "experiment-id": 1, "outcome": "kept", "score": 0.7, "strategy": "template-default", "target": "one", "timestamp": "2026-05-04 16:37:06"}
{"axis": "?", "experiment-id": 1, "outcome": "kept", "score": 0, "strategy": "template-default", "target": "one", "timestamp": "2026-05-04 16:37:06"}
{"axis": "?", "experiment-id": 2, "outcome": "kept", "score": 0, "strategy": "template-default", "target": "one", "timestamp": "2026-05-04 16:37:06"}
{"axis": "?", "experiment-id": 3, "outcome": "discarded", "score": 0, "strategy": "template-default", "target": "two", "timestamp": "2026-05-04 16:37:06"}
{"axis": "?", "experiment-id": 4, "outcome": "kept", "score": 0, "strategy": "template-default", "target": "two", "timestamp": "2026-05-04 16:37:06"}
{"axis": "?", "experiment-id": 1, "outcome": "kept", "score": 0.7, "strategy": "template-default", "target": "one", "timestamp": "2026-05-04 16:39:27"}
{"axis": "?", "experiment-id": 1, "outcome": "discarded", "score": 0.7, "strategy": "template-default", "target": "one", "timestamp": "2026-05-04 16:39:27"}
{"axis": "?", "experiment-id": 1, "outcome": "discarded", "score": 0, "strategy": "template-default", "target": "one", "timestamp": "2026-05-04 16:39:27"}
{"axis": "?", "experiment-id": 2, "outcome": "discarded", "score": 0, "strategy": "template-default", "target": "two", "timestamp": "2026-05-04 16:39:27"}
{"axis": "?", "experiment-id": 3, "outcome": "discarded", "score": 0, "strategy": "template-default", "target": "three", "timestamp": "2026-05-04 16:39:27"}
{"axis": "?", "experiment-id": 4, "outcome": "discarded", "score": 0, "strategy": "template-default", "target": "four", "timestamp": "2026-05-04 16:39:27"}
{"axis": "?", "experiment-id": 1, "outcome": "discarded", "score": 0.7, "strategy": "template-default", "target": "one", "timestamp": "2026-05-04 16:39:27"}
{"axis": "?", "experiment-id": 1, "outcome": "kept", "score": 0.7, "strategy": "template-default", "target": "one", "timestamp": "2026-05-04 16:39:27"}
{"axis": "?", "experiment-id": 1, "outcome": "kept", "score": 0, "strategy": "template-default", "target": "one", "timestamp": "2026-05-04 16:39:27"}
{"axis": "?", "experiment-id": 2, "outcome": "kept", "score": 0, "strategy": "template-default", "target": "one", "timestamp": "2026-05-04 16:39:27"}
{"axis": "?", "experiment-id": 3, "outcome": "discarded", "score": 0, "strategy": "template-default", "target": "two", "timestamp": "2026-05-04 16:39:27"}
{"axis": "?", "experiment-id": 4, "outcome": "kept", "score": 0, "strategy": "template-default", "target": "two", "timestamp": "2026-05-04 16:39:27"}
{"axis": "?", "experiment-id": 2, "outcome": "kept", "score": 0.3916666666666666, "strategy": "weighted-skills", "target": "lisp/modules/gptel-auto-workflow-strategic.el", "timestamp": "2026-05-04 16:40:11"}
{"axis": "?", "experiment-id": 3, "outcome": "discarded", "score": 0, "strategy": "template-default", "target": "lisp/modules/gptel-auto-workflow-strategic.el", "timestamp": "2026-05-04 16:43:57"}
{"axis": "?", "experiment-id": 4, "outcome": "discarded", "score": 0.39999999999999997, "strategy": "weighted-skills", "target": "lisp/modules/gptel-auto-workflow-strategic.el", "timestamp": "2026-05-04 16:54:54"}
{"axis": "?", "experiment-id": 0, "outcome": "discarded", "score": 0, "strategy": "template-default", "target": "staging-merge", "timestamp": "2026-05-04 17:09:48"}
{"axis": "?", "experiment-id": 4, "outcome": "discarded", "score": 0.39999999999999997, "strategy": "weighted-skills", "target": "lisp/modules/gptel-auto-workflow-strategic.el", "timestamp": "2026-05-04 17:09:48"}
{"axis": "?", "experiment-id": 5, "outcome": "discarded", "score": 0.39999999999999997, "strategy": "weighted-skills", "target": "lisp/modules/gptel-auto-workflow-strategic.el", "timestamp": "2026-05-04 17:17:44"}
{"axis": "?", "experiment-id": 0, "outcome": "discarded", "score": 0, "strategy": "template-default", "target": "staging-review", "timestamp": "2026-05-04 17:40:55"}
{"axis": "?", "experiment-id": 5, "outcome": "discarded", "score": 0.39999999999999997, "strategy": "weighted-skills", "target": "lisp/modules/gptel-auto-workflow-strategic.el", "timestamp": "2026-05-04 17:40:55"}
{"axis": "?", "experiment-id": 6, "outcome": "discarded", "score": 0.3916666666666666, "strategy": "weighted-skills", "target": "lisp/modules/gptel-auto-workflow-strategic.el", "timestamp": "2026-05-04 17:46:41"}
{"axis": "?", "experiment-id": 1, "outcome": "discarded", "score": 0.39999999999999997, "strategy": "weighted-skills", "target": "lisp/modules/gptel-ext-context-cache.el", "timestamp": "2026-05-04 17:51:03"}
{"axis": "?", "experiment-id": 1, "outcome": "kept", "score": 0.7, "strategy": "template-default", "target": "one", "timestamp": "2026-05-04 17:53:15"}
{"axis": "?", "experiment-id": 1, "outcome": "discarded", "score": 0.7, "strategy": "template-default", "target": "one", "timestamp": "2026-05-04 17:53:15"}
{"axis": "?", "experiment-id": 1, "outcome": "discarded", "score": 0, "strategy": "template-default", "target": "one", "timestamp": "2026-05-04 17:53:15"}
{"axis": "?", "experiment-id": 2, "outcome": "discarded", "score": 0, "strategy": "template-default", "target": "two", "timestamp": "2026-05-04 17:53:15"}
{"axis": "?", "experiment-id": 3, "outcome": "discarded", "score": 0, "strategy": "template-default", "target": "three", "timestamp": "2026-05-04 17:53:15"}
{"axis": "?", "experiment-id": 4, "outcome": "discarded", "score": 0, "strategy": "template-default", "target": "four", "timestamp": "2026-05-04 17:53:15"}
{"axis": "?", "experiment-id": 1, "outcome": "discarded", "score": 0.7, "strategy": "template-default", "target": "one", "timestamp": "2026-05-04 17:53:15"}
{"axis": "?", "experiment-id": 1, "outcome": "kept", "score": 0.7, "strategy": "template-default", "target": "one", "timestamp": "2026-05-04 17:53:15"}
{"axis": "?", "experiment-id": 1, "outcome": "kept", "score": 0, "strategy": "template-default", "target": "one", "timestamp": "2026-05-04 17:53:15"}
{"axis": "?", "experiment-id": 2, "outcome": "kept", "score": 0, "strategy": "template-default", "target": "one", "timestamp": "2026-05-04 17:53:15"}
{"axis": "?", "experiment-id": 3, "outcome": "discarded", "score": 0, "strategy": "template-default", "target": "two", "timestamp": "2026-05-04 17:53:15"}
{"axis": "?", "experiment-id": 4, "outcome": "kept", "score": 0, "strategy": "template-default", "target": "two", "timestamp": "2026-05-04 17:53:15"}
{"axis": "?", "experiment-id": 1, "outcome": "kept", "score": 0.7, "strategy": "template-default", "target": "one", "timestamp": "2026-05-04 17:55:32"}
{"axis": "?", "experiment-id": 1, "outcome": "discarded", "score": 0.7, "strategy": "template-default", "target": "one", "timestamp": "2026-05-04 17:55:32"}
{"axis": "?", "experiment-id": 1, "outcome": "discarded", "score": 0, "strategy": "template-default", "target": "one", "timestamp": "2026-05-04 17:55:32"}
{"axis": "?", "experiment-id": 2, "outcome": "discarded", "score": 0, "strategy": "template-default", "target": "two", "timestamp": "2026-05-04 17:55:32"}
{"axis": "?", "experiment-id": 3, "outcome": "discarded", "score": 0, "strategy": "template-default", "target": "three", "timestamp": "2026-05-04 17:55:32"}
{"axis": "?", "experiment-id": 4, "outcome": "discarded", "score": 0, "strategy": "template-default", "target": "four", "timestamp": "2026-05-04 17:55:32"}
{"axis": "?", "experiment-id": 1, "outcome": "discarded", "score": 0.7, "strategy": "template-default", "target": "one", "timestamp": "2026-05-04 17:55:32"}
{"axis": "?", "experiment-id": 1, "outcome": "kept", "score": 0.7, "strategy": "template-default", "target": "one", "timestamp": "2026-05-04 17:55:32"}
{"axis": "?", "experiment-id": 1, "outcome": "kept", "score": 0, "strategy": "template-default", "target": "one", "timestamp": "2026-05-04 17:55:32"}
{"axis": "?", "experiment-id": 2, "outcome": "kept", "score": 0, "strategy": "template-default", "target": "one", "timestamp": "2026-05-04 17:55:32"}
{"axis": "?", "experiment-id": 3, "outcome": "discarded", "score": 0, "strategy": "template-default", "target": "two", "timestamp": "2026-05-04 17:55:32"}
{"axis": "?", "experiment-id": 4, "outcome": "kept", "score": 0, "strategy": "template-default", "target": "two", "timestamp": "2026-05-04 17:55:32"}
{"axis": "?", "experiment-id": 1, "outcome": "kept", "score": 0.39999999999999997, "strategy": "weighted-skills", "target": "lisp/modules/gptel-ext-context-cache.el", "timestamp": "2026-05-04 17:56:14"}
{"axis": "?", "experiment-id": 2, "outcome": "discarded", "score": 0.39999999999999997, "strategy": "weighted-skills", "target": "lisp/modules/gptel-ext-context-cache.el", "timestamp": "2026-05-04 18:01:09"}
{"axis": "?", "experiment-id": 3, "outcome": "discarded", "score": 0.39999999999999997, "strategy": "weighted-skills", "target": "lisp/modules/gptel-ext-context-cache.el", "timestamp": "2026-05-04 18:05:34"}
{"axis": "?", "experiment-id": 1, "outcome": "discarded", "score": 0.39999999999999997, "strategy": "weighted-skills", "target": "lisp/modules/gptel-ext-context-cache.el", "timestamp": "2026-05-04 19:07:03"}
{"axis": "?", "experiment-id": 1, "outcome": "kept", "score": 0.7, "strategy": "template-default", "target": "one", "timestamp": "2026-05-04 19:09:14"}
{"axis": "?", "experiment-id": 1, "outcome": "discarded", "score": 0.7, "strategy": "template-default", "target": "one", "timestamp": "2026-05-04 19:09:14"}
{"axis": "?", "experiment-id": 1, "outcome": "discarded", "score": 0, "strategy": "template-default", "target": "one", "timestamp": "2026-05-04 19:09:14"}
{"axis": "?", "experiment-id": 2, "outcome": "discarded", "score": 0, "strategy": "template-default", "target": "two", "timestamp": "2026-05-04 19:09:14"}
{"axis": "?", "experiment-id": 3, "outcome": "discarded", "score": 0, "strategy": "template-default", "target": "three", "timestamp": "2026-05-04 19:09:14"}
{"axis": "?", "experiment-id": 4, "outcome": "discarded", "score": 0, "strategy": "template-default", "target": "four", "timestamp": "2026-05-04 19:09:14"}
{"axis": "?", "experiment-id": 1, "outcome": "discarded", "score": 0.7, "strategy": "template-default", "target": "one", "timestamp": "2026-05-04 19:09:15"}
{"axis": "?", "experiment-id": 1, "outcome": "kept", "score": 0.7, "strategy": "template-default", "target": "one", "timestamp": "2026-05-04 19:09:15"}
{"axis": "?", "experiment-id": 1, "outcome": "kept", "score": 0, "strategy": "template-default", "target": "one", "timestamp": "2026-05-04 19:09:15"}
{"axis": "?", "experiment-id": 2, "outcome": "kept", "score": 0, "strategy": "template-default", "target": "one", "timestamp": "2026-05-04 19:09:15"}
{"axis": "?", "experiment-id": 3, "outcome": "discarded", "score": 0, "strategy": "template-default", "target": "two", "timestamp": "2026-05-04 19:09:15"}
{"axis": "?", "experiment-id": 4, "outcome": "kept", "score": 0, "strategy": "template-default", "target": "two", "timestamp": "2026-05-04 19:09:15"}
{"axis": "?", "experiment-id": 1, "outcome": "kept", "score": 0.7, "strategy": "template-default", "target": "one", "timestamp": "2026-05-04 19:11:27"}
{"axis": "?", "experiment-id": 1, "outcome": "discarded", "score": 0.7, "strategy": "template-default", "target": "one", "timestamp": "2026-05-04 19:11:27"}
{"axis": "?", "experiment-id": 1, "outcome": "discarded", "score": 0, "strategy": "template-default", "target": "one", "timestamp": "2026-05-04 19:11:27"}
{"axis": "?", "experiment-id": 2, "outcome": "discarded", "score": 0, "strategy": "template-default", "target": "two", "timestamp": "2026-05-04 19:11:27"}
{"axis": "?", "experiment-id": 3, "outcome": "discarded", "score": 0, "strategy": "template-default", "target": "three", "timestamp": "2026-05-04 19:11:27"}
{"axis": "?", "experiment-id": 4, "outcome": "discarded", "score": 0, "strategy": "template-default", "target": "four", "timestamp": "2026-05-04 19:11:27"}
{"axis": "?", "experiment-id": 1, "outcome": "discarded", "score": 0.7, "strategy": "template-default", "target": "one", "timestamp": "2026-05-04 19:11:27"}
{"axis": "?", "experiment-id": 1, "outcome": "kept", "score": 0.7, "strategy": "template-default", "target": "one", "timestamp": "2026-05-04 19:11:27"}
