{"axis": "?", "experiment-id": 3, "outcome": "discarded", "score": 0, "strategy": "template-default", "target": "two", "timestamp": "2026-05-04 12:01:42"}
{"axis": "?", "experiment-id": 4, "outcome": "kept", "score": 0, "strategy": "template-default", "target": "two", "timestamp": "2026-05-04 12:01:42"}
{"axis": "?", "experiment-id": 1, "outcome": "kept", "score": 0.39999999999999997, "strategy": "weighted-skills", "target": "lisp/modules/gptel-tools-agent-worktree.el", "timestamp": "2026-05-04 12:02:24"}
{"axis": "?", "experiment-id": 2, "outcome": "discarded", "score": 0.39999999999999997, "strategy": "weighted-skills", "target": "lisp/modules/gptel-tools-agent-worktree.el", "timestamp": "2026-05-04 12:07:10"}
{"axis": "?", "experiment-id": 3, "outcome": "discarded", "score": 0.39999999999999997, "strategy": "weighted-skills", "target": "lisp/modules/gptel-tools-agent-worktree.el", "timestamp": "2026-05-04 12:11:47"}
{"axis": "?", "experiment-id": 1, "outcome": "discarded", "score": 0.39999999999999997, "strategy": "weighted-skills", "target": "lisp/modules/gptel-tools-agent-staging-baseline.el", "timestamp": "2026-05-04 12:16:32"}
{"axis": "?", "experiment-id": 1, "outcome": "kept", "score": 0.7, "strategy": "template-default", "target": "one", "timestamp": "2026-05-04 12:18:59"}
{"axis": "?", "experiment-id": 1, "outcome": "discarded", "score": 0.7, "strategy": "template-default", "target": "one", "timestamp": "2026-05-04 12:18:59"}
{"axis": "?", "experiment-id": 1, "outcome": "discarded", "score": 0, "strategy": "template-default", "target": "one", "timestamp": "2026-05-04 12:18:59"}
{"axis": "?", "experiment-id": 2, "outcome": "discarded", "score": 0, "strategy": "template-default", "target": "two", "timestamp": "2026-05-04 12:18:59"}
{"axis": "?", "experiment-id": 3, "outcome": "discarded", "score": 0, "strategy": "template-default", "target": "three", "timestamp": "2026-05-04 12:18:59"}
{"axis": "?", "experiment-id": 4, "outcome": "discarded", "score": 0, "strategy": "template-default", "target": "four", "timestamp": "2026-05-04 12:18:59"}
{"axis": "?", "experiment-id": 1, "outcome": "discarded", "score": 0.7, "strategy": "template-default", "target": "one", "timestamp": "2026-05-04 12:18:59"}
{"axis": "?", "experiment-id": 1, "outcome": "kept", "score": 0.7, "strategy": "template-default", "target": "one", "timestamp": "2026-05-04 12:18:59"}
{"axis": "?", "experiment-id": 1, "outcome": "kept", "score": 0, "strategy": "template-default", "target": "one", "timestamp": "2026-05-04 12:18:59"}
{"axis": "?", "experiment-id": 2, "outcome": "kept", "score": 0, "strategy": "template-default", "target": "one", "timestamp": "2026-05-04 12:18:59"}
{"axis": "?", "experiment-id": 3, "outcome": "discarded", "score": 0, "strategy": "template-default", "target": "two", "timestamp": "2026-05-04 12:18:59"}
{"axis": "?", "experiment-id": 4, "outcome": "kept", "score": 0, "strategy": "template-default", "target": "two", "timestamp": "2026-05-04 12:18:59"}
{"axis": "?", "experiment-id": 1, "outcome": "kept", "score": 0.7, "strategy": "template-default", "target": "one", "timestamp": "2026-05-04 12:21:15"}
{"axis": "?", "experiment-id": 1, "outcome": "discarded", "score": 0.7, "strategy": "template-default", "target": "one", "timestamp": "2026-05-04 12:21:15"}
{"axis": "?", "experiment-id": 1, "outcome": "discarded", "score": 0, "strategy": "template-default", "target": "one", "timestamp": "2026-05-04 12:21:15"}
{"axis": "?", "experiment-id": 2, "outcome": "discarded", "score": 0, "strategy": "template-default", "target": "two", "timestamp": "2026-05-04 12:21:15"}
{"axis": "?", "experiment-id": 3, "outcome": "discarded", "score": 0, "strategy": "template-default", "target": "three", "timestamp": "2026-05-04 12:21:15"}
{"axis": "?", "experiment-id": 4, "outcome": "discarded", "score": 0, "strategy": "template-default", "target": "four", "timestamp": "2026-05-04 12:21:15"}
{"axis": "?", "experiment-id": 1, "outcome": "discarded", "score": 0.7, "strategy": "template-default", "target": "one", "timestamp": "2026-05-04 12:21:15"}
{"axis": "?", "experiment-id": 1, "outcome": "kept", "score": 0.7, "strategy": "template-default", "target": "one", "timestamp": "2026-05-04 12:21:15"}
{"axis": "?", "experiment-id": 1, "outcome": "kept", "score": 0, "strategy": "template-default", "target": "one", "timestamp": "2026-05-04 12:21:15"}
{"axis": "?", "experiment-id": 2, "outcome": "kept", "score": 0, "strategy": "template-default", "target": "one", "timestamp": "2026-05-04 12:21:15"}
{"axis": "?", "experiment-id": 3, "outcome": "discarded", "score": 0, "strategy": "template-default", "target": "two", "timestamp": "2026-05-04 12:21:15"}
{"axis": "?", "experiment-id": 4, "outcome": "kept", "score": 0, "strategy": "template-default", "target": "two", "timestamp": "2026-05-04 12:21:15"}
{"axis": "?", "experiment-id": 1, "outcome": "kept", "score": 0.39999999999999997, "strategy": "weighted-skills", "target": "lisp/modules/gptel-tools-agent-staging-baseline.el", "timestamp": "2026-05-04 12:21:57"}
{"axis": "?", "experiment-id": 2, "outcome": "discarded", "score": 0.39999999999999997, "strategy": "weighted-skills", "target": "lisp/modules/gptel-tools-agent-staging-baseline.el", "timestamp": "2026-05-04 12:28:40"}
{"axis": "?", "experiment-id": 3, "outcome": "discarded", "score": 0.39999999999999997, "strategy": "weighted-skills", "target": "lisp/modules/gptel-tools-agent-staging-baseline.el", "timestamp": "2026-05-04 12:35:54"}
{"axis": "?", "experiment-id": 1, "outcome": "discarded", "score": 0.39999999999999997, "strategy": "weighted-skills", "target": "lisp/modules/gptel-ext-context-cache.el", "timestamp": "2026-05-04 12:41:15"}
{"axis": "?", "experiment-id": 1, "outcome": "kept", "score": 0.7, "strategy": "template-default", "target": "one", "timestamp": "2026-05-04 12:43:04"}
{"axis": "?", "experiment-id": 1, "outcome": "discarded", "score": 0.7, "strategy": "template-default", "target": "one", "timestamp": "2026-05-04 12:43:04"}
{"axis": "?", "experiment-id": 1, "outcome": "discarded", "score": 0, "strategy": "template-default", "target": "one", "timestamp": "2026-05-04 12:43:04"}
{"axis": "?", "experiment-id": 2, "outcome": "discarded", "score": 0, "strategy": "template-default", "target": "two", "timestamp": "2026-05-04 12:43:04"}
{"axis": "?", "experiment-id": 3, "outcome": "discarded", "score": 0, "strategy": "template-default", "target": "three", "timestamp": "2026-05-04 12:43:04"}
{"axis": "?", "experiment-id": 4, "outcome": "discarded", "score": 0, "strategy": "template-default", "target": "four", "timestamp": "2026-05-04 12:43:04"}
{"axis": "?", "experiment-id": 1, "outcome": "discarded", "score": 0.7, "strategy": "template-default", "target": "one", "timestamp": "2026-05-04 12:43:04"}
{"axis": "?", "experiment-id": 1, "outcome": "kept", "score": 0.7, "strategy": "template-default", "target": "one", "timestamp": "2026-05-04 12:43:04"}
{"axis": "?", "experiment-id": 1, "outcome": "kept", "score": 0, "strategy": "template-default", "target": "one", "timestamp": "2026-05-04 12:43:04"}
{"axis": "?", "experiment-id": 2, "outcome": "kept", "score": 0, "strategy": "template-default", "target": "one", "timestamp": "2026-05-04 12:43:04"}
{"axis": "?", "experiment-id": 3, "outcome": "discarded", "score": 0, "strategy": "template-default", "target": "two", "timestamp": "2026-05-04 12:43:04"}
{"axis": "?", "experiment-id": 4, "outcome": "kept", "score": 0, "strategy": "template-default", "target": "two", "timestamp": "2026-05-04 12:43:04"}
{"axis": "?", "experiment-id": 1, "outcome": "kept", "score": 0.7, "strategy": "template-default", "target": "one", "timestamp": "2026-05-04 12:45:24"}
{"axis": "?", "experiment-id": 1, "outcome": "discarded", "score": 0.7, "strategy": "template-default", "target": "one", "timestamp": "2026-05-04 12:45:24"}
{"axis": "?", "experiment-id": 1, "outcome": "discarded", "score": 0, "strategy": "template-default", "target": "one", "timestamp": "2026-05-04 12:45:24"}
{"axis": "?", "experiment-id": 2, "outcome": "discarded", "score": 0, "strategy": "template-default", "target": "two", "timestamp": "2026-05-04 12:45:24"}
{"axis": "?", "experiment-id": 3, "outcome": "discarded", "score": 0, "strategy": "template-default", "target": "three", "timestamp": "2026-05-04 12:45:24"}
{"axis": "?", "experiment-id": 4, "outcome": "discarded", "score": 0, "strategy": "template-default", "target": "four", "timestamp": "2026-05-04 12:45:24"}
{"axis": "?", "experiment-id": 1, "outcome": "discarded", "score": 0.7, "strategy": "template-default", "target": "one", "timestamp": "2026-05-04 12:45:24"}
{"axis": "?", "experiment-id": 1, "outcome": "kept", "score": 0.7, "strategy": "template-default", "target": "one", "timestamp": "2026-05-04 12:45:24"}
{"axis": "?", "experiment-id": 1, "outcome": "kept", "score": 0, "strategy": "template-default", "target": "one", "timestamp": "2026-05-04 12:45:24"}
{"axis": "?", "experiment-id": 2, "outcome": "kept", "score": 0, "strategy": "template-default", "target": "one", "timestamp": "2026-05-04 12:45:24"}
{"axis": "?", "experiment-id": 3, "outcome": "discarded", "score": 0, "strategy": "template-default", "target": "two", "timestamp": "2026-05-04 12:45:24"}
{"axis": "?", "experiment-id": 4, "outcome": "kept", "score": 0, "strategy": "template-default", "target": "two", "timestamp": "2026-05-04 12:45:24"}
{"axis": "?", "experiment-id": 1, "outcome": "kept", "score": 0.7, "strategy": "template-default", "target": "one", "timestamp": "2026-05-04 12:47:44"}
{"axis": "?", "experiment-id": 1, "outcome": "discarded", "score": 0.7, "strategy": "template-default", "target": "one", "timestamp": "2026-05-04 12:47:44"}
{"axis": "?", "experiment-id": 1, "outcome": "discarded", "score": 0, "strategy": "template-default", "target": "one", "timestamp": "2026-05-04 12:47:44"}
{"axis": "?", "experiment-id": 2, "outcome": "discarded", "score": 0, "strategy": "template-default", "target": "two", "timestamp": "2026-05-04 12:47:44"}
{"axis": "?", "experiment-id": 3, "outcome": "discarded", "score": 0, "strategy": "template-default", "target": "three", "timestamp": "2026-05-04 12:47:44"}
{"axis": "?", "experiment-id": 4, "outcome": "discarded", "score": 0, "strategy": "template-default", "target": "four", "timestamp": "2026-05-04 12:47:44"}
{"axis": "?", "experiment-id": 1, "outcome": "discarded", "score": 0.7, "strategy": "template-default", "target": "one", "timestamp": "2026-05-04 12:47:44"}
{"axis": "?", "experiment-id": 1, "outcome": "kept", "score": 0.7, "strategy": "template-default", "target": "one", "timestamp": "2026-05-04 12:47:44"}
{"axis": "?", "experiment-id": 1, "outcome": "kept", "score": 0, "strategy": "template-default", "target": "one", "timestamp": "2026-05-04 12:47:44"}
{"axis": "?", "experiment-id": 2, "outcome": "kept", "score": 0, "strategy": "template-default", "target": "one", "timestamp": "2026-05-04 12:47:44"}
{"axis": "?", "experiment-id": 3, "outcome": "discarded", "score": 0, "strategy": "template-default", "target": "two", "timestamp": "2026-05-04 12:47:44"}
{"axis": "?", "experiment-id": 4, "outcome": "kept", "score": 0, "strategy": "template-default", "target": "two", "timestamp": "2026-05-04 12:47:44"}
{"axis": "?", "experiment-id": 1, "outcome": "kept", "score": 0.39999999999999997, "strategy": "weighted-skills", "target": "lisp/modules/gptel-ext-context-cache.el", "timestamp": "2026-05-04 12:48:31"}
{"axis": "?", "experiment-id": 1, "outcome": "kept", "score": 0.7, "strategy": "template-default", "target": "one", "timestamp": "2026-05-04 12:57:03"}
{"axis": "?", "experiment-id": 1, "outcome": "discarded", "score": 0.7, "strategy": "template-default", "target": "one", "timestamp": "2026-05-04 12:57:03"}
{"axis": "?", "experiment-id": 1, "outcome": "discarded", "score": 0, "strategy": "template-default", "target": "one", "timestamp": "2026-05-04 12:57:03"}
{"axis": "?", "experiment-id": 2, "outcome": "discarded", "score": 0, "strategy": "template-default", "target": "two", "timestamp": "2026-05-04 12:57:03"}
{"axis": "?", "experiment-id": 3, "outcome": "discarded", "score": 0, "strategy": "template-default", "target": "three", "timestamp": "2026-05-04 12:57:03"}
{"axis": "?", "experiment-id": 4, "outcome": "discarded", "score": 0, "strategy": "template-default", "target": "four", "timestamp": "2026-05-04 12:57:03"}
{"axis": "?", "experiment-id": 1, "outcome": "discarded", "score": 0.7, "strategy": "template-default", "target": "one", "timestamp": "2026-05-04 12:57:03"}
{"axis": "?", "experiment-id": 1, "outcome": "kept", "score": 0.7, "strategy": "template-default", "target": "one", "timestamp": "2026-05-04 12:57:04"}
{"axis": "?", "experiment-id": 1, "outcome": "kept", "score": 0, "strategy": "template-default", "target": "one", "timestamp": "2026-05-04 12:57:04"}
{"axis": "?", "experiment-id": 2, "outcome": "kept", "score": 0, "strategy": "template-default", "target": "one", "timestamp": "2026-05-04 12:57:04"}
{"axis": "?", "experiment-id": 3, "outcome": "discarded", "score": 0, "strategy": "template-default", "target": "two", "timestamp": "2026-05-04 12:57:04"}
{"axis": "?", "experiment-id": 4, "outcome": "kept", "score": 0, "strategy": "template-default", "target": "two", "timestamp": "2026-05-04 12:57:04"}
{"axis": "?", "experiment-id": 2, "outcome": "discarded", "score": 0.39999999999999997, "strategy": "weighted-skills", "target": "lisp/modules/gptel-ext-context-cache.el", "timestamp": "2026-05-04 12:57:31"}
{"axis": "?", "experiment-id": 3, "outcome": "discarded", "score": 0.39999999999999997, "strategy": "weighted-skills", "target": "lisp/modules/gptel-ext-context-cache.el", "timestamp": "2026-05-04 13:04:12"}
{"axis": "?", "experiment-id": 1, "outcome": "discarded", "score": 0.39999999999999997, "strategy": "weighted-skills", "target": "lisp/modules/gptel-workflow-benchmark.el", "timestamp": "2026-05-04 15:07:42"}
{"axis": "?", "experiment-id": 1, "outcome": "kept", "score": 0.7, "strategy": "template-default", "target": "one", "timestamp": "2026-05-04 15:09:53"}
{"axis": "?", "experiment-id": 1, "outcome": "discarded", "score": 0.7, "strategy": "template-default", "target": "one", "timestamp": "2026-05-04 15:09:53"}
{"axis": "?", "experiment-id": 1, "outcome": "discarded", "score": 0, "strategy": "template-default", "target": "one", "timestamp": "2026-05-04 15:09:53"}
{"axis": "?", "experiment-id": 2, "outcome": "discarded", "score": 0, "strategy": "template-default", "target": "two", "timestamp": "2026-05-04 15:09:53"}
{"axis": "?", "experiment-id": 3, "outcome": "discarded", "score": 0, "strategy": "template-default", "target": "three", "timestamp": "2026-05-04 15:09:53"}
{"axis": "?", "experiment-id": 4, "outcome": "discarded", "score": 0, "strategy": "template-default", "target": "four", "timestamp": "2026-05-04 15:09:53"}
{"axis": "?", "experiment-id": 1, "outcome": "discarded", "score": 0.7, "strategy": "template-default", "target": "one", "timestamp": "2026-05-04 15:09:53"}
{"axis": "?", "experiment-id": 1, "outcome": "kept", "score": 0.7, "strategy": "template-default", "target": "one", "timestamp": "2026-05-04 15:09:53"}
{"axis": "?", "experiment-id": 1, "outcome": "kept", "score": 0, "strategy": "template-default", "target": "one", "timestamp": "2026-05-04 15:09:53"}
{"axis": "?", "experiment-id": 2, "outcome": "kept", "score": 0, "strategy": "template-default", "target": "one", "timestamp": "2026-05-04 15:09:53"}
{"axis": "?", "experiment-id": 3, "outcome": "discarded", "score": 0, "strategy": "template-default", "target": "two", "timestamp": "2026-05-04 15:09:53"}
{"axis": "?", "experiment-id": 4, "outcome": "kept", "score": 0, "strategy": "template-default", "target": "two", "timestamp": "2026-05-04 15:09:53"}
{"axis": "?", "experiment-id": 1, "outcome": "kept", "score": 0.7, "strategy": "template-default", "target": "one", "timestamp": "2026-05-04 15:12:10"}
{"axis": "?", "experiment-id": 1, "outcome": "discarded", "score": 0.7, "strategy": "template-default", "target": "one", "timestamp": "2026-05-04 15:12:10"}
{"axis": "?", "experiment-id": 1, "outcome": "discarded", "score": 0, "strategy": "template-default", "target": "one", "timestamp": "2026-05-04 15:12:10"}
{"axis": "?", "experiment-id": 2, "outcome": "discarded", "score": 0, "strategy": "template-default", "target": "two", "timestamp": "2026-05-04 15:12:10"}
{"axis": "?", "experiment-id": 3, "outcome": "discarded", "score": 0, "strategy": "template-default", "target": "three", "timestamp": "2026-05-04 15:12:10"}
{"axis": "?", "experiment-id": 4, "outcome": "discarded", "score": 0, "strategy": "template-default", "target": "four", "timestamp": "2026-05-04 15:12:10"}
{"axis": "?", "experiment-id": 1, "outcome": "discarded", "score": 0.7, "strategy": "template-default", "target": "one", "timestamp": "2026-05-04 15:12:10"}
{"axis": "?", "experiment-id": 1, "outcome": "kept", "score": 0.7, "strategy": "template-default", "target": "one", "timestamp": "2026-05-04 15:12:10"}
{"axis": "?", "experiment-id": 1, "outcome": "kept", "score": 0, "strategy": "template-default", "target": "one", "timestamp": "2026-05-04 15:12:10"}
{"axis": "?", "experiment-id": 2, "outcome": "kept", "score": 0, "strategy": "template-default", "target": "one", "timestamp": "2026-05-04 15:12:10"}
{"axis": "?", "experiment-id": 3, "outcome": "discarded", "score": 0, "strategy": "template-default", "target": "two", "timestamp": "2026-05-04 15:12:10"}
{"axis": "?", "experiment-id": 4, "outcome": "kept", "score": 0, "strategy": "template-default", "target": "two", "timestamp": "2026-05-04 15:12:10"}
{"axis": "?", "experiment-id": 1, "outcome": "kept", "score": 0.39999999999999997, "strategy": "weighted-skills", "target": "lisp/modules/gptel-workflow-benchmark.el", "timestamp": "2026-05-04 15:12:52"}
{"axis": "?", "experiment-id": 2, "outcome": "discarded", "score": 0.39999999999999997, "strategy": "weighted-skills", "target": "lisp/modules/gptel-workflow-benchmark.el", "timestamp": "2026-05-04 15:18:33"}
{"axis": "?", "experiment-id": 3, "outcome": "discarded", "score": 0.39999999999999997, "strategy": "weighted-skills", "target": "lisp/modules/gptel-workflow-benchmark.el", "timestamp": "2026-05-04 15:23:58"}
{"axis": "?", "experiment-id": 1, "outcome": "discarded", "score": 0.39999999999999997, "strategy": "weighted-skills", "target": "lisp/modules/gptel-auto-workflow-behavioral-tests.el", "timestamp": "2026-05-04 15:28:24"}
{"axis": "?", "experiment-id": 1, "outcome": "kept", "score": 0.7, "strategy": "template-default", "target": "one", "timestamp": "2026-05-04 15:30:26"}
{"axis": "?", "experiment-id": 1, "outcome": "discarded", "score": 0.7, "strategy": "template-default", "target": "one", "timestamp": "2026-05-04 15:30:26"}
{"axis": "?", "experiment-id": 1, "outcome": "discarded", "score": 0, "strategy": "template-default", "target": "one", "timestamp": "2026-05-04 15:30:26"}
{"axis": "?", "experiment-id": 2, "outcome": "discarded", "score": 0, "strategy": "template-default", "target": "two", "timestamp": "2026-05-04 15:30:26"}
{"axis": "?", "experiment-id": 3, "outcome": "discarded", "score": 0, "strategy": "template-default", "target": "three", "timestamp": "2026-05-04 15:30:26"}
{"axis": "?", "experiment-id": 4, "outcome": "discarded", "score": 0, "strategy": "template-default", "target": "four", "timestamp": "2026-05-04 15:30:26"}
{"axis": "?", "experiment-id": 1, "outcome": "discarded", "score": 0.7, "strategy": "template-default", "target": "one", "timestamp": "2026-05-04 15:30:26"}
{"axis": "?", "experiment-id": 1, "outcome": "kept", "score": 0.7, "strategy": "template-default", "target": "one", "timestamp": "2026-05-04 15:30:26"}
{"axis": "?", "experiment-id": 1, "outcome": "kept", "score": 0, "strategy": "template-default", "target": "one", "timestamp": "2026-05-04 15:30:26"}
{"axis": "?", "experiment-id": 2, "outcome": "kept", "score": 0, "strategy": "template-default", "target": "one", "timestamp": "2026-05-04 15:30:26"}
{"axis": "?", "experiment-id": 3, "outcome": "discarded", "score": 0, "strategy": "template-default", "target": "two", "timestamp": "2026-05-04 15:30:26"}
{"axis": "?", "experiment-id": 4, "outcome": "kept", "score": 0, "strategy": "template-default", "target": "two", "timestamp": "2026-05-04 15:30:26"}
{"axis": "?", "experiment-id": 1, "outcome": "kept", "score": 0.39999999999999997, "strategy": "weighted-skills", "target": "lisp/modules/gptel-auto-workflow-behavioral-tests.el", "timestamp": "2026-05-04 15:31:08"}
{"axis": "?", "experiment-id": 2, "outcome": "discarded", "score": 0.39999999999999997, "strategy": "weighted-skills", "target": "lisp/modules/gptel-auto-workflow-behavioral-tests.el", "timestamp": "2026-05-04 15:34:34"}
{"axis": "?", "experiment-id": 3, "outcome": "discarded", "score": 0.39999999999999997, "strategy": "weighted-skills", "target": "lisp/modules/gptel-auto-workflow-behavioral-tests.el", "timestamp": "2026-05-04 15:39:20"}
{"axis": "?", "experiment-id": 1, "outcome": "discarded", "score": 0.39999999999999997, "strategy": "weighted-skills", "target": "lisp/modules/gptel-tools-agent-worktree.el", "timestamp": "2026-05-04 15:49:47"}
{"axis": "?", "experiment-id": 1, "outcome": "kept", "score": 0.7, "strategy": "template-default", "target": "one", "timestamp": "2026-05-04 15:51:55"}
{"axis": "?", "experiment-id": 1, "outcome": "discarded", "score": 0.7, "strategy": "template-default", "target": "one", "timestamp": "2026-05-04 15:51:55"}
{"axis": "?", "experiment-id": 1, "outcome": "discarded", "score": 0, "strategy": "template-default", "target": "one", "timestamp": "2026-05-04 15:51:55"}
{"axis": "?", "experiment-id": 2, "outcome": "discarded", "score": 0, "strategy": "template-default", "target": "two", "timestamp": "2026-05-04 15:51:55"}
{"axis": "?", "experiment-id": 3, "outcome": "discarded", "score": 0, "strategy": "template-default", "target": "three", "timestamp": "2026-05-04 15:51:55"}
