{"axis": "?", "experiment-id": 2, "outcome": "discarded", "score": 0.39999999999999997, "strategy": "template-default", "target": "lisp/modules/gptel-ext-context-cache.el", "timestamp": "2026-05-03 14:44:33"}
{"axis": "?", "experiment-id": 3, "outcome": "discarded", "score": 0.39999999999999997, "strategy": "template-default", "target": "lisp/modules/gptel-ext-context-cache.el", "timestamp": "2026-05-03 14:51:53"}
{"axis": "?", "experiment-id": 1, "outcome": "discarded", "score": 0.4125, "strategy": "template-default", "target": "lisp/modules/gptel-agent-loop.el", "timestamp": "2026-05-03 14:58:31"}
{"axis": "?", "experiment-id": 1, "outcome": "kept", "score": 0.7, "strategy": "template-default", "target": "one", "timestamp": "2026-05-03 15:00:45"}
{"axis": "?", "experiment-id": 1, "outcome": "discarded", "score": 0.7, "strategy": "template-default", "target": "one", "timestamp": "2026-05-03 15:00:45"}
{"axis": "?", "experiment-id": 1, "outcome": "discarded", "score": 0, "strategy": "template-default", "target": "one", "timestamp": "2026-05-03 15:00:45"}
{"axis": "?", "experiment-id": 2, "outcome": "discarded", "score": 0, "strategy": "template-default", "target": "two", "timestamp": "2026-05-03 15:00:45"}
{"axis": "?", "experiment-id": 3, "outcome": "discarded", "score": 0, "strategy": "template-default", "target": "three", "timestamp": "2026-05-03 15:00:45"}
{"axis": "?", "experiment-id": 4, "outcome": "discarded", "score": 0, "strategy": "template-default", "target": "four", "timestamp": "2026-05-03 15:00:45"}
{"axis": "?", "experiment-id": 1, "outcome": "discarded", "score": 0.7, "strategy": "template-default", "target": "one", "timestamp": "2026-05-03 15:00:45"}
{"axis": "?", "experiment-id": 1, "outcome": "kept", "score": 0.7, "strategy": "template-default", "target": "one", "timestamp": "2026-05-03 15:00:45"}
{"axis": "?", "experiment-id": 1, "outcome": "kept", "score": 0, "strategy": "template-default", "target": "one", "timestamp": "2026-05-03 15:00:45"}
{"axis": "?", "experiment-id": 2, "outcome": "kept", "score": 0, "strategy": "template-default", "target": "one", "timestamp": "2026-05-03 15:00:45"}
{"axis": "?", "experiment-id": 3, "outcome": "discarded", "score": 0, "strategy": "template-default", "target": "two", "timestamp": "2026-05-03 15:00:45"}
{"axis": "?", "experiment-id": 4, "outcome": "kept", "score": 0, "strategy": "template-default", "target": "two", "timestamp": "2026-05-03 15:00:45"}
{"axis": "?", "experiment-id": 1, "outcome": "kept", "score": 0.4125, "strategy": "template-default", "target": "lisp/modules/gptel-agent-loop.el", "timestamp": "2026-05-03 15:01:46"}
{"axis": "?", "experiment-id": 2, "outcome": "discarded", "score": 0.39999999999999997, "strategy": "template-default", "target": "lisp/modules/gptel-agent-loop.el", "timestamp": "2026-05-03 15:07:26"}
{"axis": "?", "experiment-id": 3, "outcome": "discarded", "score": 0.39999999999999997, "strategy": "template-default", "target": "lisp/modules/gptel-agent-loop.el", "timestamp": "2026-05-03 15:15:38"}
{"axis": "?", "experiment-id": 1, "outcome": "discarded", "score": 0.4125, "strategy": "template-default", "target": "lisp/modules/gptel-ext-retry.el", "timestamp": "2026-05-03 15:26:59"}
{"axis": "?", "experiment-id": 1, "outcome": "kept", "score": 0.7, "strategy": "template-default", "target": "one", "timestamp": "2026-05-03 15:29:15"}
{"axis": "?", "experiment-id": 1, "outcome": "discarded", "score": 0.7, "strategy": "template-default", "target": "one", "timestamp": "2026-05-03 15:29:15"}
{"axis": "?", "experiment-id": 1, "outcome": "discarded", "score": 0, "strategy": "template-default", "target": "one", "timestamp": "2026-05-03 15:29:15"}
{"axis": "?", "experiment-id": 2, "outcome": "discarded", "score": 0, "strategy": "template-default", "target": "two", "timestamp": "2026-05-03 15:29:15"}
{"axis": "?", "experiment-id": 3, "outcome": "discarded", "score": 0, "strategy": "template-default", "target": "three", "timestamp": "2026-05-03 15:29:15"}
{"axis": "?", "experiment-id": 4, "outcome": "discarded", "score": 0, "strategy": "template-default", "target": "four", "timestamp": "2026-05-03 15:29:15"}
{"axis": "?", "experiment-id": 1, "outcome": "discarded", "score": 0.7, "strategy": "template-default", "target": "one", "timestamp": "2026-05-03 15:29:15"}
{"axis": "?", "experiment-id": 1, "outcome": "kept", "score": 0.7, "strategy": "template-default", "target": "one", "timestamp": "2026-05-03 15:29:15"}
{"axis": "?", "experiment-id": 1, "outcome": "kept", "score": 0, "strategy": "template-default", "target": "one", "timestamp": "2026-05-03 15:29:15"}
{"axis": "?", "experiment-id": 2, "outcome": "kept", "score": 0, "strategy": "template-default", "target": "one", "timestamp": "2026-05-03 15:29:15"}
{"axis": "?", "experiment-id": 3, "outcome": "discarded", "score": 0, "strategy": "template-default", "target": "two", "timestamp": "2026-05-03 15:29:15"}
{"axis": "?", "experiment-id": 4, "outcome": "kept", "score": 0, "strategy": "template-default", "target": "two", "timestamp": "2026-05-03 15:29:15"}
{"axis": "?", "experiment-id": 1, "outcome": "kept", "score": 0.7, "strategy": "template-default", "target": "one", "timestamp": "2026-05-03 15:32:08"}
{"axis": "?", "experiment-id": 1, "outcome": "discarded", "score": 0.7, "strategy": "template-default", "target": "one", "timestamp": "2026-05-03 15:32:08"}
{"axis": "?", "experiment-id": 1, "outcome": "discarded", "score": 0, "strategy": "template-default", "target": "one", "timestamp": "2026-05-03 15:32:08"}
{"axis": "?", "experiment-id": 2, "outcome": "discarded", "score": 0, "strategy": "template-default", "target": "two", "timestamp": "2026-05-03 15:32:08"}
{"axis": "?", "experiment-id": 3, "outcome": "discarded", "score": 0, "strategy": "template-default", "target": "three", "timestamp": "2026-05-03 15:32:08"}
{"axis": "?", "experiment-id": 4, "outcome": "discarded", "score": 0, "strategy": "template-default", "target": "four", "timestamp": "2026-05-03 15:32:09"}
{"axis": "?", "experiment-id": 1, "outcome": "discarded", "score": 0.7, "strategy": "template-default", "target": "one", "timestamp": "2026-05-03 15:32:09"}
{"axis": "?", "experiment-id": 1, "outcome": "kept", "score": 0.7, "strategy": "template-default", "target": "one", "timestamp": "2026-05-03 15:32:09"}
{"axis": "?", "experiment-id": 1, "outcome": "kept", "score": 0, "strategy": "template-default", "target": "one", "timestamp": "2026-05-03 15:32:09"}
{"axis": "?", "experiment-id": 2, "outcome": "kept", "score": 0, "strategy": "template-default", "target": "one", "timestamp": "2026-05-03 15:32:09"}
{"axis": "?", "experiment-id": 3, "outcome": "discarded", "score": 0, "strategy": "template-default", "target": "two", "timestamp": "2026-05-03 15:32:09"}
{"axis": "?", "experiment-id": 4, "outcome": "kept", "score": 0, "strategy": "template-default", "target": "two", "timestamp": "2026-05-03 15:32:09"}
{"axis": "?", "experiment-id": 1, "outcome": "kept", "score": 0.4125, "strategy": "template-default", "target": "lisp/modules/gptel-ext-retry.el", "timestamp": "2026-05-03 15:33:09"}
{"axis": "?", "experiment-id": 2, "outcome": "discarded", "score": 0.4125, "strategy": "template-default", "target": "lisp/modules/gptel-ext-retry.el", "timestamp": "2026-05-03 15:39:27"}
{"axis": "?", "experiment-id": 3, "outcome": "discarded", "score": 0.4125, "strategy": "template-default", "target": "lisp/modules/gptel-ext-retry.el", "timestamp": "2026-05-03 15:43:48"}
{"axis": "?", "experiment-id": 1, "outcome": "discarded", "score": 0.39999999999999997, "strategy": "template-default", "target": "lisp/modules/gptel-tools-agent-benchmark.el", "timestamp": "2026-05-03 15:49:25"}
{"axis": "?", "experiment-id": 1, "outcome": "kept", "score": 0.7, "strategy": "template-default", "target": "one", "timestamp": "2026-05-03 15:51:36"}
{"axis": "?", "experiment-id": 1, "outcome": "discarded", "score": 0.7, "strategy": "template-default", "target": "one", "timestamp": "2026-05-03 15:51:36"}
{"axis": "?", "experiment-id": 1, "outcome": "discarded", "score": 0, "strategy": "template-default", "target": "one", "timestamp": "2026-05-03 15:51:36"}
{"axis": "?", "experiment-id": 2, "outcome": "discarded", "score": 0, "strategy": "template-default", "target": "two", "timestamp": "2026-05-03 15:51:36"}
{"axis": "?", "experiment-id": 3, "outcome": "discarded", "score": 0, "strategy": "template-default", "target": "three", "timestamp": "2026-05-03 15:51:36"}
{"axis": "?", "experiment-id": 4, "outcome": "discarded", "score": 0, "strategy": "template-default", "target": "four", "timestamp": "2026-05-03 15:51:36"}
{"axis": "?", "experiment-id": 1, "outcome": "discarded", "score": 0.7, "strategy": "template-default", "target": "one", "timestamp": "2026-05-03 15:51:36"}
{"axis": "?", "experiment-id": 1, "outcome": "kept", "score": 0.7, "strategy": "template-default", "target": "one", "timestamp": "2026-05-03 15:51:36"}
{"axis": "?", "experiment-id": 1, "outcome": "kept", "score": 0, "strategy": "template-default", "target": "one", "timestamp": "2026-05-03 15:51:36"}
{"axis": "?", "experiment-id": 2, "outcome": "kept", "score": 0, "strategy": "template-default", "target": "one", "timestamp": "2026-05-03 15:51:36"}
{"axis": "?", "experiment-id": 3, "outcome": "discarded", "score": 0, "strategy": "template-default", "target": "two", "timestamp": "2026-05-03 15:51:36"}
{"axis": "?", "experiment-id": 4, "outcome": "kept", "score": 0, "strategy": "template-default", "target": "two", "timestamp": "2026-05-03 15:51:37"}
{"axis": "?", "experiment-id": 1, "outcome": "kept", "score": 0.39999999999999997, "strategy": "template-default", "target": "lisp/modules/gptel-tools-agent-benchmark.el", "timestamp": "2026-05-03 15:52:37"}
{"axis": "?", "experiment-id": 2, "outcome": "discarded", "score": 0.39999999999999997, "strategy": "template-default", "target": "lisp/modules/gptel-tools-agent-benchmark.el", "timestamp": "2026-05-03 15:57:25"}
{"axis": "?", "experiment-id": 3, "outcome": "discarded", "score": 0.39999999999999997, "strategy": "template-default", "target": "lisp/modules/gptel-tools-agent-benchmark.el", "timestamp": "2026-05-03 16:04:27"}
{"axis": "?", "experiment-id": 1, "outcome": "discarded", "score": 0.39999999999999997, "strategy": "template-default", "target": "lisp/modules/gptel-ext-context-cache.el", "timestamp": "2026-05-03 23:09:15"}
{"axis": "?", "experiment-id": 1, "outcome": "kept", "score": 0.7, "strategy": "template-default", "target": "one", "timestamp": "2026-05-03 23:11:10"}
{"axis": "?", "experiment-id": 1, "outcome": "discarded", "score": 0.7, "strategy": "template-default", "target": "one", "timestamp": "2026-05-03 23:11:10"}
{"axis": "?", "experiment-id": 1, "outcome": "discarded", "score": 0, "strategy": "template-default", "target": "one", "timestamp": "2026-05-03 23:11:10"}
{"axis": "?", "experiment-id": 2, "outcome": "discarded", "score": 0, "strategy": "template-default", "target": "two", "timestamp": "2026-05-03 23:11:10"}
{"axis": "?", "experiment-id": 3, "outcome": "discarded", "score": 0, "strategy": "template-default", "target": "three", "timestamp": "2026-05-03 23:11:10"}
{"axis": "?", "experiment-id": 4, "outcome": "discarded", "score": 0, "strategy": "template-default", "target": "four", "timestamp": "2026-05-03 23:11:10"}
{"axis": "?", "experiment-id": 1, "outcome": "discarded", "score": 0.7, "strategy": "template-default", "target": "one", "timestamp": "2026-05-03 23:11:10"}
{"axis": "?", "experiment-id": 1, "outcome": "kept", "score": 0.7, "strategy": "template-default", "target": "one", "timestamp": "2026-05-03 23:11:10"}
{"axis": "?", "experiment-id": 1, "outcome": "kept", "score": 0, "strategy": "template-default", "target": "one", "timestamp": "2026-05-03 23:11:10"}
{"axis": "?", "experiment-id": 2, "outcome": "kept", "score": 0, "strategy": "template-default", "target": "one", "timestamp": "2026-05-03 23:11:10"}
{"axis": "?", "experiment-id": 3, "outcome": "discarded", "score": 0, "strategy": "template-default", "target": "two", "timestamp": "2026-05-03 23:11:10"}
{"axis": "?", "experiment-id": 4, "outcome": "kept", "score": 0, "strategy": "template-default", "target": "two", "timestamp": "2026-05-03 23:11:10"}
{"axis": "?", "experiment-id": 1, "outcome": "kept", "score": 0.39999999999999997, "strategy": "template-default", "target": "lisp/modules/gptel-ext-context-cache.el", "timestamp": "2026-05-03 23:11:52"}
{"axis": "?", "experiment-id": 2, "outcome": "discarded", "score": 0.39999999999999997, "strategy": "template-default", "target": "lisp/modules/gptel-ext-context-cache.el", "timestamp": "2026-05-03 23:17:19"}
{"axis": "?", "experiment-id": 3, "outcome": "discarded", "score": 0.39999999999999997, "strategy": "template-default", "target": "lisp/modules/gptel-ext-context-cache.el", "timestamp": "2026-05-03 23:22:11"}
{"axis": "?", "experiment-id": 1, "outcome": "discarded", "score": 0.39999999999999997, "strategy": "template-default", "target": "lisp/modules/gptel-sandbox.el", "timestamp": "2026-05-03 23:27:00"}
{"axis": "?", "experiment-id": 1, "outcome": "kept", "score": 0.7, "strategy": "template-default", "target": "one", "timestamp": "2026-05-03 23:28:50"}
{"axis": "?", "experiment-id": 1, "outcome": "discarded", "score": 0.7, "strategy": "template-default", "target": "one", "timestamp": "2026-05-03 23:28:50"}
{"axis": "?", "experiment-id": 1, "outcome": "discarded", "score": 0, "strategy": "template-default", "target": "one", "timestamp": "2026-05-03 23:28:50"}
{"axis": "?", "experiment-id": 2, "outcome": "discarded", "score": 0, "strategy": "template-default", "target": "two", "timestamp": "2026-05-03 23:28:50"}
{"axis": "?", "experiment-id": 3, "outcome": "discarded", "score": 0, "strategy": "template-default", "target": "three", "timestamp": "2026-05-03 23:28:50"}
{"axis": "?", "experiment-id": 4, "outcome": "discarded", "score": 0, "strategy": "template-default", "target": "four", "timestamp": "2026-05-03 23:28:50"}
{"axis": "?", "experiment-id": 1, "outcome": "discarded", "score": 0.7, "strategy": "template-default", "target": "one", "timestamp": "2026-05-03 23:28:50"}
{"axis": "?", "experiment-id": 1, "outcome": "kept", "score": 0.7, "strategy": "template-default", "target": "one", "timestamp": "2026-05-03 23:28:50"}
{"axis": "?", "experiment-id": 1, "outcome": "kept", "score": 0, "strategy": "template-default", "target": "one", "timestamp": "2026-05-03 23:28:50"}
{"axis": "?", "experiment-id": 2, "outcome": "kept", "score": 0, "strategy": "template-default", "target": "one", "timestamp": "2026-05-03 23:28:50"}
{"axis": "?", "experiment-id": 3, "outcome": "discarded", "score": 0, "strategy": "template-default", "target": "two", "timestamp": "2026-05-03 23:28:50"}
{"axis": "?", "experiment-id": 4, "outcome": "kept", "score": 0, "strategy": "template-default", "target": "two", "timestamp": "2026-05-03 23:28:50"}
{"axis": "?", "experiment-id": 1, "outcome": "kept", "score": 0.39999999999999997, "strategy": "template-default", "target": "lisp/modules/gptel-sandbox.el", "timestamp": "2026-05-03 23:29:32"}
{"axis": "?", "experiment-id": 2, "outcome": "discarded", "score": 0.39999999999999997, "strategy": "template-default", "target": "lisp/modules/gptel-sandbox.el", "timestamp": "2026-05-03 23:33:50"}
{"axis": "?", "experiment-id": 3, "outcome": "discarded", "score": 0.39999999999999997, "strategy": "template-default", "target": "lisp/modules/gptel-sandbox.el", "timestamp": "2026-05-03 23:38:44"}
{"axis": "?", "experiment-id": 1, "outcome": "discarded", "score": 0.39999999999999997, "strategy": "template-default", "target": "lisp/modules/gptel-tools-agent-staging-merge.el", "timestamp": "2026-05-03 23:44:36"}
{"axis": "?", "experiment-id": 1, "outcome": "kept", "score": 0.7, "strategy": "template-default", "target": "one", "timestamp": "2026-05-03 23:46:28"}
{"axis": "?", "experiment-id": 1, "outcome": "discarded", "score": 0.7, "strategy": "template-default", "target": "one", "timestamp": "2026-05-03 23:46:28"}
{"axis": "?", "experiment-id": 1, "outcome": "discarded", "score": 0, "strategy": "template-default", "target": "one", "timestamp": "2026-05-03 23:46:28"}
{"axis": "?", "experiment-id": 2, "outcome": "discarded", "score": 0, "strategy": "template-default", "target": "two", "timestamp": "2026-05-03 23:46:28"}
{"axis": "?", "experiment-id": 3, "outcome": "discarded", "score": 0, "strategy": "template-default", "target": "three", "timestamp": "2026-05-03 23:46:28"}
{"axis": "?", "experiment-id": 4, "outcome": "discarded", "score": 0, "strategy": "template-default", "target": "four", "timestamp": "2026-05-03 23:46:28"}
{"axis": "?", "experiment-id": 1, "outcome": "discarded", "score": 0.7, "strategy": "template-default", "target": "one", "timestamp": "2026-05-03 23:46:28"}
{"axis": "?", "experiment-id": 1, "outcome": "kept", "score": 0.7, "strategy": "template-default", "target": "one", "timestamp": "2026-05-03 23:46:28"}
{"axis": "?", "experiment-id": 1, "outcome": "kept", "score": 0, "strategy": "template-default", "target": "one", "timestamp": "2026-05-03 23:46:28"}
{"axis": "?", "experiment-id": 2, "outcome": "kept", "score": 0, "strategy": "template-default", "target": "one", "timestamp": "2026-05-03 23:46:28"}
{"axis": "?", "experiment-id": 3, "outcome": "discarded", "score": 0, "strategy": "template-default", "target": "two", "timestamp": "2026-05-03 23:46:28"}
{"axis": "?", "experiment-id": 4, "outcome": "kept", "score": 0, "strategy": "template-default", "target": "two", "timestamp": "2026-05-03 23:46:28"}
{"axis": "?", "experiment-id": 1, "outcome": "kept", "score": 0.39999999999999997, "strategy": "template-default", "target": "lisp/modules/gptel-tools-agent-staging-merge.el", "timestamp": "2026-05-03 23:47:10"}
{"axis": "?", "experiment-id": 2, "outcome": "discarded", "score": 0.39999999999999997, "strategy": "template-default", "target": "lisp/modules/gptel-tools-agent-staging-merge.el", "timestamp": "2026-05-04 00:01:06"}
{"axis": "?", "experiment-id": 3, "outcome": "discarded", "score": 0.39999999999999997, "strategy": "template-default", "target": "lisp/modules/gptel-tools-agent-staging-merge.el", "timestamp": "2026-05-04 00:10:39"}
{"axis": "?", "experiment-id": 1, "outcome": "discarded", "score": 0.39999999999999997, "strategy": "template-default", "target": "lisp/modules/gptel-tools-agent-git.el", "timestamp": "2026-05-04 00:18:03"}
{"axis": "?", "experiment-id": 1, "outcome": "kept", "score": 0.7, "strategy": "template-default", "target": "one", "timestamp": "2026-05-04 00:20:07"}
{"axis": "?", "experiment-id": 1, "outcome": "discarded", "score": 0.7, "strategy": "template-default", "target": "one", "timestamp": "2026-05-04 00:20:07"}
{"axis": "?", "experiment-id": 1, "outcome": "discarded", "score": 0, "strategy": "template-default", "target": "one", "timestamp": "2026-05-04 00:20:07"}
{"axis": "?", "experiment-id": 2, "outcome": "discarded", "score": 0, "strategy": "template-default", "target": "two", "timestamp": "2026-05-04 00:20:07"}
{"axis": "?", "experiment-id": 3, "outcome": "discarded", "score": 0, "strategy": "template-default", "target": "three", "timestamp": "2026-05-04 00:20:07"}
{"axis": "?", "experiment-id": 4, "outcome": "discarded", "score": 0, "strategy": "template-default", "target": "four", "timestamp": "2026-05-04 00:20:07"}
{"axis": "?", "experiment-id": 1, "outcome": "discarded", "score": 0.7, "strategy": "template-default", "target": "one", "timestamp": "2026-05-04 00:20:07"}
{"axis": "?", "experiment-id": 1, "outcome": "kept", "score": 0.7, "strategy": "template-default", "target": "one", "timestamp": "2026-05-04 00:20:07"}
{"axis": "?", "experiment-id": 1, "outcome": "kept", "score": 0, "strategy": "template-default", "target": "one", "timestamp": "2026-05-04 00:20:07"}
{"axis": "?", "experiment-id": 2, "outcome": "kept", "score": 0, "strategy": "template-default", "target": "one", "timestamp": "2026-05-04 00:20:07"}
{"axis": "?", "experiment-id": 3, "outcome": "discarded", "score": 0, "strategy": "template-default", "target": "two", "timestamp": "2026-05-04 00:20:07"}
{"axis": "?", "experiment-id": 4, "outcome": "kept", "score": 0, "strategy": "template-default", "target": "two", "timestamp": "2026-05-04 00:20:07"}
{"axis": "?", "experiment-id": 1, "outcome": "kept", "score": 0.39999999999999997, "strategy": "template-default", "target": "lisp/modules/gptel-tools-agent-git.el", "timestamp": "2026-05-04 00:20:49"}
{"axis": "?", "experiment-id": 2, "outcome": "discarded", "score": 0.39999999999999997, "strategy": "template-default", "target": "lisp/modules/gptel-tools-agent-git.el", "timestamp": "2026-05-04 00:30:57"}
{"axis": "?", "experiment-id": 3, "outcome": "discarded", "score": 0.39999999999999997, "strategy": "template-default", "target": "lisp/modules/gptel-tools-agent-git.el", "timestamp": "2026-05-04 00:36:09"}
{"axis": "?", "experiment-id": 1, "outcome": "discarded", "score": 0.4125, "strategy": "template-default", "target": "lisp/modules/gptel-auto-workflow-behavioral-tests.el", "timestamp": "2026-05-04 00:39:43"}
{"axis": "?", "experiment-id": 1, "outcome": "kept", "score": 0.7, "strategy": "template-default", "target": "one", "timestamp": "2026-05-04 00:41:46"}
{"axis": "?", "experiment-id": 1, "outcome": "discarded", "score": 0.7, "strategy": "template-default", "target": "one", "timestamp": "2026-05-04 00:41:46"}
{"axis": "?", "experiment-id": 1, "outcome": "discarded", "score": 0, "strategy": "template-default", "target": "one", "timestamp": "2026-05-04 00:41:46"}
{"axis": "?", "experiment-id": 2, "outcome": "discarded", "score": 0, "strategy": "template-default", "target": "two", "timestamp": "2026-05-04 00:41:46"}
{"axis": "?", "experiment-id": 3, "outcome": "discarded", "score": 0, "strategy": "template-default", "target": "three", "timestamp": "2026-05-04 00:41:46"}
