{"axis": "?", "experiment-id": 1, "outcome": "kept", "score": 0, "strategy": "template-default", "target": "one", "timestamp": "2026-05-04 19:11:27"}
{"axis": "?", "experiment-id": 2, "outcome": "kept", "score": 0, "strategy": "template-default", "target": "one", "timestamp": "2026-05-04 19:11:27"}
{"axis": "?", "experiment-id": 3, "outcome": "discarded", "score": 0, "strategy": "template-default", "target": "two", "timestamp": "2026-05-04 19:11:27"}
{"axis": "?", "experiment-id": 4, "outcome": "kept", "score": 0, "strategy": "template-default", "target": "two", "timestamp": "2026-05-04 19:11:27"}
{"axis": "?", "experiment-id": 0, "outcome": "discarded", "score": 0, "strategy": "template-default", "target": "staging-verification", "timestamp": "2026-05-04 19:12:08"}
{"axis": "?", "experiment-id": 1, "outcome": "discarded", "score": 0.39999999999999997, "strategy": "weighted-skills", "target": "lisp/modules/gptel-ext-context-cache.el", "timestamp": "2026-05-04 19:12:09"}
{"axis": "?", "experiment-id": 2, "outcome": "discarded", "score": 0.39999999999999997, "strategy": "weighted-skills", "target": "lisp/modules/gptel-ext-context-cache.el", "timestamp": "2026-05-04 19:18:41"}
{"axis": "?", "experiment-id": 1, "outcome": "kept", "score": 0.7, "strategy": "template-default", "target": "one", "timestamp": "2026-05-04 19:20:51"}
{"axis": "?", "experiment-id": 1, "outcome": "discarded", "score": 0.7, "strategy": "template-default", "target": "one", "timestamp": "2026-05-04 19:20:51"}
{"axis": "?", "experiment-id": 1, "outcome": "discarded", "score": 0, "strategy": "template-default", "target": "one", "timestamp": "2026-05-04 19:20:51"}
{"axis": "?", "experiment-id": 2, "outcome": "discarded", "score": 0, "strategy": "template-default", "target": "two", "timestamp": "2026-05-04 19:20:51"}
{"axis": "?", "experiment-id": 3, "outcome": "discarded", "score": 0, "strategy": "template-default", "target": "three", "timestamp": "2026-05-04 19:20:51"}
{"axis": "?", "experiment-id": 4, "outcome": "discarded", "score": 0, "strategy": "template-default", "target": "four", "timestamp": "2026-05-04 19:20:51"}
{"axis": "?", "experiment-id": 1, "outcome": "discarded", "score": 0.7, "strategy": "template-default", "target": "one", "timestamp": "2026-05-04 19:20:51"}
{"axis": "?", "experiment-id": 1, "outcome": "kept", "score": 0.7, "strategy": "template-default", "target": "one", "timestamp": "2026-05-04 19:20:51"}
{"axis": "?", "experiment-id": 1, "outcome": "kept", "score": 0, "strategy": "template-default", "target": "one", "timestamp": "2026-05-04 19:20:51"}
{"axis": "?", "experiment-id": 2, "outcome": "kept", "score": 0, "strategy": "template-default", "target": "one", "timestamp": "2026-05-04 19:20:51"}
{"axis": "?", "experiment-id": 3, "outcome": "discarded", "score": 0, "strategy": "template-default", "target": "two", "timestamp": "2026-05-04 19:20:51"}
{"axis": "?", "experiment-id": 4, "outcome": "kept", "score": 0, "strategy": "template-default", "target": "two", "timestamp": "2026-05-04 19:20:51"}
{"axis": "?", "experiment-id": 1, "outcome": "kept", "score": 0.7, "strategy": "template-default", "target": "one", "timestamp": "2026-05-04 19:23:08"}
{"axis": "?", "experiment-id": 1, "outcome": "discarded", "score": 0.7, "strategy": "template-default", "target": "one", "timestamp": "2026-05-04 19:23:08"}
{"axis": "?", "experiment-id": 1, "outcome": "discarded", "score": 0, "strategy": "template-default", "target": "one", "timestamp": "2026-05-04 19:23:08"}
{"axis": "?", "experiment-id": 2, "outcome": "discarded", "score": 0, "strategy": "template-default", "target": "two", "timestamp": "2026-05-04 19:23:08"}
{"axis": "?", "experiment-id": 3, "outcome": "discarded", "score": 0, "strategy": "template-default", "target": "three", "timestamp": "2026-05-04 19:23:08"}
{"axis": "?", "experiment-id": 4, "outcome": "discarded", "score": 0, "strategy": "template-default", "target": "four", "timestamp": "2026-05-04 19:23:08"}
{"axis": "?", "experiment-id": 1, "outcome": "discarded", "score": 0.7, "strategy": "template-default", "target": "one", "timestamp": "2026-05-04 19:23:08"}
{"axis": "?", "experiment-id": 1, "outcome": "kept", "score": 0.7, "strategy": "template-default", "target": "one", "timestamp": "2026-05-04 19:23:08"}
{"axis": "?", "experiment-id": 1, "outcome": "kept", "score": 0, "strategy": "template-default", "target": "one", "timestamp": "2026-05-04 19:23:08"}
{"axis": "?", "experiment-id": 2, "outcome": "kept", "score": 0, "strategy": "template-default", "target": "one", "timestamp": "2026-05-04 19:23:08"}
{"axis": "?", "experiment-id": 3, "outcome": "discarded", "score": 0, "strategy": "template-default", "target": "two", "timestamp": "2026-05-04 19:23:08"}
{"axis": "?", "experiment-id": 4, "outcome": "kept", "score": 0, "strategy": "template-default", "target": "two", "timestamp": "2026-05-04 19:23:08"}
{"axis": "?", "experiment-id": 2, "outcome": "kept", "score": 0.39999999999999997, "strategy": "weighted-skills", "target": "lisp/modules/gptel-ext-context-cache.el", "timestamp": "2026-05-04 19:23:50"}
{"axis": "?", "experiment-id": 3, "outcome": "discarded", "score": 0.39999999999999997, "strategy": "weighted-skills", "target": "lisp/modules/gptel-ext-context-cache.el", "timestamp": "2026-05-04 19:29:18"}
{"axis": "?", "experiment-id": 4, "outcome": "discarded", "score": 0, "strategy": "template-default", "target": "lisp/modules/gptel-ext-context-cache.el", "timestamp": "2026-05-04 19:34:23"}
{"axis": "?", "experiment-id": 1, "outcome": "discarded", "score": 0.39999999999999997, "strategy": "weighted-skills", "target": "lisp/modules/gptel-sandbox.el", "timestamp": "2026-05-04 19:39:39"}
{"axis": "?", "experiment-id": 1, "outcome": "kept", "score": 0.7, "strategy": "template-default", "target": "one", "timestamp": "2026-05-04 19:41:39"}
{"axis": "?", "experiment-id": 1, "outcome": "discarded", "score": 0.7, "strategy": "template-default", "target": "one", "timestamp": "2026-05-04 19:41:39"}
{"axis": "?", "experiment-id": 1, "outcome": "discarded", "score": 0, "strategy": "template-default", "target": "one", "timestamp": "2026-05-04 19:41:39"}
{"axis": "?", "experiment-id": 2, "outcome": "discarded", "score": 0, "strategy": "template-default", "target": "two", "timestamp": "2026-05-04 19:41:39"}
{"axis": "?", "experiment-id": 3, "outcome": "discarded", "score": 0, "strategy": "template-default", "target": "three", "timestamp": "2026-05-04 19:41:39"}
{"axis": "?", "experiment-id": 4, "outcome": "discarded", "score": 0, "strategy": "template-default", "target": "four", "timestamp": "2026-05-04 19:41:39"}
{"axis": "?", "experiment-id": 1, "outcome": "discarded", "score": 0.7, "strategy": "template-default", "target": "one", "timestamp": "2026-05-04 19:41:39"}
{"axis": "?", "experiment-id": 1, "outcome": "kept", "score": 0.7, "strategy": "template-default", "target": "one", "timestamp": "2026-05-04 19:41:39"}
{"axis": "?", "experiment-id": 1, "outcome": "kept", "score": 0, "strategy": "template-default", "target": "one", "timestamp": "2026-05-04 19:41:39"}
{"axis": "?", "experiment-id": 2, "outcome": "kept", "score": 0, "strategy": "template-default", "target": "one", "timestamp": "2026-05-04 19:41:39"}
{"axis": "?", "experiment-id": 3, "outcome": "discarded", "score": 0, "strategy": "template-default", "target": "two", "timestamp": "2026-05-04 19:41:39"}
{"axis": "?", "experiment-id": 4, "outcome": "kept", "score": 0, "strategy": "template-default", "target": "two", "timestamp": "2026-05-04 19:41:39"}
{"axis": "?", "experiment-id": 1, "outcome": "kept", "score": 0.7, "strategy": "template-default", "target": "one", "timestamp": "2026-05-04 19:43:57"}
{"axis": "?", "experiment-id": 1, "outcome": "discarded", "score": 0.7, "strategy": "template-default", "target": "one", "timestamp": "2026-05-04 19:43:57"}
{"axis": "?", "experiment-id": 1, "outcome": "discarded", "score": 0, "strategy": "template-default", "target": "one", "timestamp": "2026-05-04 19:43:57"}
{"axis": "?", "experiment-id": 2, "outcome": "discarded", "score": 0, "strategy": "template-default", "target": "two", "timestamp": "2026-05-04 19:43:57"}
{"axis": "?", "experiment-id": 3, "outcome": "discarded", "score": 0, "strategy": "template-default", "target": "three", "timestamp": "2026-05-04 19:43:57"}
{"axis": "?", "experiment-id": 4, "outcome": "discarded", "score": 0, "strategy": "template-default", "target": "four", "timestamp": "2026-05-04 19:43:57"}
{"axis": "?", "experiment-id": 1, "outcome": "discarded", "score": 0.7, "strategy": "template-default", "target": "one", "timestamp": "2026-05-04 19:43:57"}
{"axis": "?", "experiment-id": 1, "outcome": "kept", "score": 0.7, "strategy": "template-default", "target": "one", "timestamp": "2026-05-04 19:43:57"}
{"axis": "?", "experiment-id": 1, "outcome": "kept", "score": 0, "strategy": "template-default", "target": "one", "timestamp": "2026-05-04 19:43:57"}
{"axis": "?", "experiment-id": 2, "outcome": "kept", "score": 0, "strategy": "template-default", "target": "one", "timestamp": "2026-05-04 19:43:57"}
{"axis": "?", "experiment-id": 3, "outcome": "discarded", "score": 0, "strategy": "template-default", "target": "two", "timestamp": "2026-05-04 19:43:57"}
{"axis": "?", "experiment-id": 4, "outcome": "kept", "score": 0, "strategy": "template-default", "target": "two", "timestamp": "2026-05-04 19:43:57"}
{"axis": "?", "experiment-id": 1, "outcome": "kept", "score": 0.39999999999999997, "strategy": "weighted-skills", "target": "lisp/modules/gptel-sandbox.el", "timestamp": "2026-05-04 19:44:39"}
{"axis": "?", "experiment-id": 2, "outcome": "discarded", "score": 0.39999999999999997, "strategy": "weighted-skills", "target": "lisp/modules/gptel-sandbox.el", "timestamp": "2026-05-04 19:49:04"}
{"axis": "?", "experiment-id": 3, "outcome": "discarded", "score": 0.39999999999999997, "strategy": "weighted-skills", "target": "lisp/modules/gptel-sandbox.el", "timestamp": "2026-05-04 19:54:16"}
{"axis": "?", "experiment-id": 1, "outcome": "discarded", "score": 0.39999999999999997, "strategy": "weighted-skills", "target": "lisp/modules/gptel-ext-tool-confirm.el", "timestamp": "2026-05-04 19:59:45"}
{"axis": "?", "experiment-id": 1, "outcome": "kept", "score": 0.7, "strategy": "template-default", "target": "one", "timestamp": "2026-05-04 20:01:39"}
{"axis": "?", "experiment-id": 1, "outcome": "discarded", "score": 0.7, "strategy": "template-default", "target": "one", "timestamp": "2026-05-04 20:01:39"}
{"axis": "?", "experiment-id": 1, "outcome": "discarded", "score": 0, "strategy": "template-default", "target": "one", "timestamp": "2026-05-04 20:01:39"}
{"axis": "?", "experiment-id": 2, "outcome": "discarded", "score": 0, "strategy": "template-default", "target": "two", "timestamp": "2026-05-04 20:01:39"}
{"axis": "?", "experiment-id": 3, "outcome": "discarded", "score": 0, "strategy": "template-default", "target": "three", "timestamp": "2026-05-04 20:01:39"}
{"axis": "?", "experiment-id": 4, "outcome": "discarded", "score": 0, "strategy": "template-default", "target": "four", "timestamp": "2026-05-04 20:01:39"}
{"axis": "?", "experiment-id": 1, "outcome": "discarded", "score": 0.7, "strategy": "template-default", "target": "one", "timestamp": "2026-05-04 20:01:39"}
{"axis": "?", "experiment-id": 1, "outcome": "kept", "score": 0.7, "strategy": "template-default", "target": "one", "timestamp": "2026-05-04 20:01:39"}
{"axis": "?", "experiment-id": 1, "outcome": "kept", "score": 0, "strategy": "template-default", "target": "one", "timestamp": "2026-05-04 20:01:39"}
{"axis": "?", "experiment-id": 2, "outcome": "kept", "score": 0, "strategy": "template-default", "target": "one", "timestamp": "2026-05-04 20:01:39"}
{"axis": "?", "experiment-id": 3, "outcome": "discarded", "score": 0, "strategy": "template-default", "target": "two", "timestamp": "2026-05-04 20:01:39"}
{"axis": "?", "experiment-id": 4, "outcome": "kept", "score": 0, "strategy": "template-default", "target": "two", "timestamp": "2026-05-04 20:01:39"}
{"axis": "?", "experiment-id": 1, "outcome": "kept", "score": 0.7, "strategy": "template-default", "target": "one", "timestamp": "2026-05-04 20:03:57"}
{"axis": "?", "experiment-id": 1, "outcome": "discarded", "score": 0.7, "strategy": "template-default", "target": "one", "timestamp": "2026-05-04 20:03:57"}
{"axis": "?", "experiment-id": 1, "outcome": "discarded", "score": 0, "strategy": "template-default", "target": "one", "timestamp": "2026-05-04 20:03:57"}
{"axis": "?", "experiment-id": 2, "outcome": "discarded", "score": 0, "strategy": "template-default", "target": "two", "timestamp": "2026-05-04 20:03:57"}
{"axis": "?", "experiment-id": 3, "outcome": "discarded", "score": 0, "strategy": "template-default", "target": "three", "timestamp": "2026-05-04 20:03:57"}
{"axis": "?", "experiment-id": 4, "outcome": "discarded", "score": 0, "strategy": "template-default", "target": "four", "timestamp": "2026-05-04 20:03:57"}
{"axis": "?", "experiment-id": 1, "outcome": "discarded", "score": 0.7, "strategy": "template-default", "target": "one", "timestamp": "2026-05-04 20:03:57"}
{"axis": "?", "experiment-id": 1, "outcome": "kept", "score": 0.7, "strategy": "template-default", "target": "one", "timestamp": "2026-05-04 20:03:57"}
{"axis": "?", "experiment-id": 1, "outcome": "kept", "score": 0, "strategy": "template-default", "target": "one", "timestamp": "2026-05-04 20:03:57"}
{"axis": "?", "experiment-id": 2, "outcome": "kept", "score": 0, "strategy": "template-default", "target": "one", "timestamp": "2026-05-04 20:03:57"}
{"axis": "?", "experiment-id": 3, "outcome": "discarded", "score": 0, "strategy": "template-default", "target": "two", "timestamp": "2026-05-04 20:03:57"}
{"axis": "?", "experiment-id": 4, "outcome": "kept", "score": 0, "strategy": "template-default", "target": "two", "timestamp": "2026-05-04 20:03:57"}
{"axis": "?", "experiment-id": 1, "outcome": "kept", "score": 0.39999999999999997, "strategy": "weighted-skills", "target": "lisp/modules/gptel-ext-tool-confirm.el", "timestamp": "2026-05-04 20:04:39"}
{"axis": "?", "experiment-id": 2, "outcome": "discarded", "score": 0.39999999999999997, "strategy": "weighted-skills", "target": "lisp/modules/gptel-ext-tool-confirm.el", "timestamp": "2026-05-04 20:08:42"}
{"axis": "?", "experiment-id": 1, "outcome": "kept", "score": 0.7, "strategy": "template-default", "target": "one", "timestamp": "2026-05-04 20:10:42"}
{"axis": "?", "experiment-id": 1, "outcome": "discarded", "score": 0.7, "strategy": "template-default", "target": "one", "timestamp": "2026-05-04 20:10:42"}
{"axis": "?", "experiment-id": 1, "outcome": "discarded", "score": 0, "strategy": "template-default", "target": "one", "timestamp": "2026-05-04 20:10:42"}
{"axis": "?", "experiment-id": 2, "outcome": "discarded", "score": 0, "strategy": "template-default", "target": "two", "timestamp": "2026-05-04 20:10:42"}
{"axis": "?", "experiment-id": 3, "outcome": "discarded", "score": 0, "strategy": "template-default", "target": "three", "timestamp": "2026-05-04 20:10:42"}
{"axis": "?", "experiment-id": 4, "outcome": "discarded", "score": 0, "strategy": "template-default", "target": "four", "timestamp": "2026-05-04 20:10:42"}
{"axis": "?", "experiment-id": 1, "outcome": "discarded", "score": 0.7, "strategy": "template-default", "target": "one", "timestamp": "2026-05-04 20:10:42"}
{"axis": "?", "experiment-id": 1, "outcome": "kept", "score": 0.7, "strategy": "template-default", "target": "one", "timestamp": "2026-05-04 20:10:42"}
{"axis": "?", "experiment-id": 1, "outcome": "kept", "score": 0, "strategy": "template-default", "target": "one", "timestamp": "2026-05-04 20:10:42"}
{"axis": "?", "experiment-id": 2, "outcome": "kept", "score": 0, "strategy": "template-default", "target": "one", "timestamp": "2026-05-04 20:10:42"}
{"axis": "?", "experiment-id": 3, "outcome": "discarded", "score": 0, "strategy": "template-default", "target": "two", "timestamp": "2026-05-04 20:10:42"}
{"axis": "?", "experiment-id": 4, "outcome": "kept", "score": 0, "strategy": "template-default", "target": "two", "timestamp": "2026-05-04 20:10:42"}
{"axis": "?", "experiment-id": 1, "outcome": "kept", "score": 0.7, "strategy": "template-default", "target": "one", "timestamp": "2026-05-04 20:13:00"}
{"axis": "?", "experiment-id": 1, "outcome": "discarded", "score": 0.7, "strategy": "template-default", "target": "one", "timestamp": "2026-05-04 20:13:00"}
{"axis": "?", "experiment-id": 1, "outcome": "discarded", "score": 0, "strategy": "template-default", "target": "one", "timestamp": "2026-05-04 20:13:00"}
{"axis": "?", "experiment-id": 2, "outcome": "discarded", "score": 0, "strategy": "template-default", "target": "two", "timestamp": "2026-05-04 20:13:00"}
{"axis": "?", "experiment-id": 3, "outcome": "discarded", "score": 0, "strategy": "template-default", "target": "three", "timestamp": "2026-05-04 20:13:00"}
{"axis": "?", "experiment-id": 4, "outcome": "discarded", "score": 0, "strategy": "template-default", "target": "four", "timestamp": "2026-05-04 20:13:00"}
{"axis": "?", "experiment-id": 1, "outcome": "discarded", "score": 0.7, "strategy": "template-default", "target": "one", "timestamp": "2026-05-04 20:13:00"}
{"axis": "?", "experiment-id": 1, "outcome": "kept", "score": 0.7, "strategy": "template-default", "target": "one", "timestamp": "2026-05-04 20:13:00"}
{"axis": "?", "experiment-id": 1, "outcome": "kept", "score": 0, "strategy": "template-default", "target": "one", "timestamp": "2026-05-04 20:13:00"}
{"axis": "?", "experiment-id": 2, "outcome": "kept", "score": 0, "strategy": "template-default", "target": "one", "timestamp": "2026-05-04 20:13:00"}
{"axis": "?", "experiment-id": 3, "outcome": "discarded", "score": 0, "strategy": "template-default", "target": "two", "timestamp": "2026-05-04 20:13:00"}
{"axis": "?", "experiment-id": 4, "outcome": "kept", "score": 0, "strategy": "template-default", "target": "two", "timestamp": "2026-05-04 20:13:00"}
{"axis": "?", "experiment-id": 2, "outcome": "kept", "score": 0.39999999999999997, "strategy": "weighted-skills", "target": "lisp/modules/gptel-ext-tool-confirm.el", "timestamp": "2026-05-04 20:13:42"}
{"axis": "?", "experiment-id": 3, "outcome": "discarded", "score": 0.39999999999999997, "strategy": "weighted-skills", "target": "lisp/modules/gptel-ext-tool-confirm.el", "timestamp": "2026-05-04 20:18:55"}
{"axis": "?", "experiment-id": 4, "outcome": "discarded", "score": 0.39999999999999997, "strategy": "weighted-skills", "target": "lisp/modules/gptel-ext-tool-confirm.el", "timestamp": "2026-05-04 20:24:01"}
{"axis": "?", "experiment-id": 1, "outcome": "discarded", "score": 0.39999999999999997, "strategy": "outcome-reasoning", "target": "lisp/modules/gptel-workflow-benchmark.el", "timestamp": "2026-05-04 20:29:54"}
{"axis": "?", "experiment-id": 1, "outcome": "kept", "score": 0.7, "strategy": "template-default", "target": "one", "timestamp": "2026-05-04 20:31:58"}
{"axis": "?", "experiment-id": 1, "outcome": "discarded", "score": 0.7, "strategy": "template-default", "target": "one", "timestamp": "2026-05-04 20:31:58"}
{"axis": "?", "experiment-id": 1, "outcome": "discarded", "score": 0, "strategy": "template-default", "target": "one", "timestamp": "2026-05-04 20:31:58"}
{"axis": "?", "experiment-id": 2, "outcome": "discarded", "score": 0, "strategy": "template-default", "target": "two", "timestamp": "2026-05-04 20:31:58"}
{"axis": "?", "experiment-id": 3, "outcome": "discarded", "score": 0, "strategy": "template-default", "target": "three", "timestamp": "2026-05-04 20:31:58"}
{"axis": "?", "experiment-id": 4, "outcome": "discarded", "score": 0, "strategy": "template-default", "target": "four", "timestamp": "2026-05-04 20:31:58"}
{"axis": "?", "experiment-id": 1, "outcome": "discarded", "score": 0.7, "strategy": "template-default", "target": "one", "timestamp": "2026-05-04 20:31:58"}
{"axis": "?", "experiment-id": 1, "outcome": "kept", "score": 0.7, "strategy": "template-default", "target": "one", "timestamp": "2026-05-04 20:31:58"}
{"axis": "?", "experiment-id": 1, "outcome": "kept", "score": 0, "strategy": "template-default", "target": "one", "timestamp": "2026-05-04 20:31:58"}
{"axis": "?", "experiment-id": 2, "outcome": "kept", "score": 0, "strategy": "template-default", "target": "one", "timestamp": "2026-05-04 20:31:58"}
{"axis": "?", "experiment-id": 3, "outcome": "discarded", "score": 0, "strategy": "template-default", "target": "two", "timestamp": "2026-05-04 20:31:58"}
{"axis": "?", "experiment-id": 4, "outcome": "kept", "score": 0, "strategy": "template-default", "target": "two", "timestamp": "2026-05-04 20:31:58"}
{"axis": "?", "experiment-id": 1, "outcome": "kept", "score": 0.7, "strategy": "template-default", "target": "one", "timestamp": "2026-05-04 20:34:16"}
{"axis": "?", "experiment-id": 1, "outcome": "discarded", "score": 0.7, "strategy": "template-default", "target": "one", "timestamp": "2026-05-04 20:34:16"}
{"axis": "?", "experiment-id": 1, "outcome": "discarded", "score": 0, "strategy": "template-default", "target": "one", "timestamp": "2026-05-04 20:34:16"}
{"axis": "?", "experiment-id": 2, "outcome": "discarded", "score": 0, "strategy": "template-default", "target": "two", "timestamp": "2026-05-04 20:34:16"}
{"axis": "?", "experiment-id": 3, "outcome": "discarded", "score": 0, "strategy": "template-default", "target": "three", "timestamp": "2026-05-04 20:34:16"}
{"axis": "?", "experiment-id": 4, "outcome": "discarded", "score": 0, "strategy": "template-default", "target": "four", "timestamp": "2026-05-04 20:34:16"}
{"axis": "?", "experiment-id": 1, "outcome": "discarded", "score": 0.7, "strategy": "template-default", "target": "one", "timestamp": "2026-05-04 20:34:16"}
{"axis": "?", "experiment-id": 1, "outcome": "kept", "score": 0.7, "strategy": "template-default", "target": "one", "timestamp": "2026-05-04 20:34:16"}
